Item,Marca,Precio,Categoria,Web,class_inei,codigo,genero
jean slim hombre kansas,kansas,139.99,hombre,ripley,PANTALÓN (HOMBRE > 14),312010154,hombre
polo manga corta hombre tapout terro,tapout,49.9,hombre,ripley,POLO (HOMBRE > 14),312010160,hombre
polo manga corta algodón hombre champion classic graphic tee,champion,40.0,hombre,ripley,POLO (HOMBRE > 14),312010160,hombre
zapatilla hombre nike running quest 5,nike,349.99,calzado,ripley,ZAPATILLAS (HOMBRE >14),321010303,hombre
zapatilla mujer nike running revolution 7,nike,219.87,calzado,ripley,ZAPATILLAS (MUJER > 14),321030303,mujer
zapatilla adidas senderismo ax2s hombre,adidas,273.2,calzado,ripley,ZAPATILLAS (HOMBRE >14),321010303,hombre
zapatillas hombre puma deportivas reflect lite trail ptx,puma,239.9,calzado,ripley,ZAPATILLAS (HOMBRE >14),321010303,hombre
zapatilla hombre reebok deportivas flexagon energy tr 4,reebok,131.4,calzado,ripley,ZAPATILLAS (HOMBRE >14),321010303,hombre
medias hombre new balance las16123as2 bicolor,new balance,35.99,calzado,ripley,CALCETINES (HOMBRE > 14),312010119,hombre
zapatillas hombre puma urbanas 15,puma,129.0,calzado,ripley,ZAPATILLAS (HOMBRE >14),321010303,hombre
mocasines hombre kenneth cole rsm4327am,kenneth cole,150.0,calzado,ripley,ZAPATOS (HOMBRE >14),321010121,hombre
zapatillas hombre br sport urbanas café brsport pr22751072708094989,br sport,169.9,calzado,ripley,ZAPATILLAS (HOMBRE >14),321010303,hombre
zapatillas mujer new balance deportivas wtntrlp6,new balance,279.99,calzado,ripley,ZAPATILLAS (MUJER > 14),321030303,mujer
zapatillas de basket,peak sport,329.0,calzado,ripley,ZAPATILLAS (MUJER > 14),321030303,mujer
zapatos hombre dauss urbanas marrón cuero,dauss,209.3,calzado,ripley,ZAPATOS (HOMBRE >14),321010121,hombre
zapatillas hombre navigata urbanas marino riel,navigata,80.0,calzado,ripley,ZAPATILLAS (HOMBRE >14),321010303,hombre
zapatillas tenis adidas mujer gamecourt 20,adidas,207.99,calzado,ripley,ZAPATILLAS (MUJER > 14),321030303,mujer
zapatillas urbanas adidas court low streetcheck,adidas,295.1,calzado,ripley,ZAPATILLAS (MUJER > 14),321030303,mujer
zapatilla hombre adidas running runfalcon 3 shoes,adidas,159.99,calzado,ripley,ZAPATILLAS (HOMBRE >14),321010303,hombre
zapatillas hombre puma fútbol pasto sintético ultra 5 match tt,puma,349.9,calzado,ripley,ZAPATILLAS (HOMBRE >14),321010303,hombre
zapatillas hombre nike urbanas court vision lo nn,nike,279.0,calzado,ripley,ZAPATILLAS (HOMBRE >14),321010303,hombre
zapatillas training hombre reebok reebok lite plus 4,reebok,229.99,calzado,ripley,ZAPATILLAS (HOMBRE >14),321010303,hombre
puma zapatillas urbanas graviton para hombre,puma,233.9,calzado,ripley,ZAPATILLAS (HOMBRE >14),321010303,hombre
zapatillas running de hombre apolo 66 grisnaranja 38,apolo,137.4,calzado,ripley,ZAPATILLAS (HOMBRE >14),321010303,hombre
zapatillas hombre new balance,new balance,900.0,calzado,ripley,ZAPATILLAS (HOMBRE >14),321010303,hombre
zapatillas hombre asics jogging jolt 4,asics,239.92,calzado,ripley,ZAPATILLAS (HOMBRE >14),321010303,hombre
zapatillas hombre puma urbanas court classic vulc fs,puma,189.99,calzado,ripley,ZAPATILLAS (HOMBRE >14),321010303,hombre
zapatillas hombre head urbanas epur,head,111.99,calzado,ripley,ZAPATILLAS (HOMBRE >14),321010303,hombre
zapatillas futbol futsal adidas hombre deportivo iii,adidas,159.99,calzado,ripley,ZAPATILLAS (HOMBRE >14),321010303,hombre
zapatillas hombre hi tec outdoor h006421051 v lite ox trail racer low,hi tec,279.9,calzado,ripley,ZAPATILLAS (HOMBRE >14),321010303,hombre
zapatilla hombre puma urbanas 01,puma,189.99,calzado,ripley,ZAPATILLAS (HOMBRE >14),321010303,hombre
adidas zapatillas running response para hombre,adidas,295.9,calzado,ripley,ZAPATILLAS (HOMBRE >14),321010303,hombre
zapatillas hombre adidas urbanas breaknet 20,adidas,160.99,calzado,ripley,ZAPATILLAS (HOMBRE >14),321010303,hombre
zapatilla puma shuffle para hombre,puma,209.0,calzado,ripley,ZAPATILLAS (HOMBRE >14),321010303,hombre
zapatilla adidas response super hombre,adidas,303.92,calzado,ripley,ZAPATILLAS (HOMBRE >14),321010303,hombre
zapatos casuales hombre kenneth stevens kilo,kenneth stevens,49.9,calzado,ripley,ZAPATOS (HOMBRE >14),321010121,hombre
medias new balance las03223lgh,new balance,49.9,calzado,ripley,CALCETINES (HOMBRE > 14),312010119,mujer
zapatillas hombre skechers urbanas crema ofwt,skechers,279.0,calzado,ripley,ZAPATILLAS (HOMBRE >14),321010303,hombre
zapatillas hombre steve madden urbanas cognac tabbon,steve madden,244.93,calzado,ripley,ZAPATILLAS (HOMBRE >14),321010303,hombre
polo deportivo hombre new balance mt41559lin manga corta hyperdensity graphic,new balance,71.99,calzado,ripley,ROPA DEPORTIVA (HOMBRE > 14),312010167,hombre
zuecos hombre crocs,crocs,259.0,calzado,ripley,ZAPATOS (HOMBRE >14),321010121,hombre
zapatillas hombre new balance multicolor mtntrtm5,new balance,349.0,calzado,ripley,ZAPATILLAS (HOMBRE >14),321010303,hombre
zapatillas hombre north star urbanas ns cerdena,north star,111.93,calzado,ripley,ZAPATILLAS (HOMBRE >14),321010303,hombre
zapatillas puma hombre electron e 01,puma,219.9,calzado,ripley,ZAPATILLAS (HOMBRE >14),321010303,hombre
zapatillas adidas para hombre grand court 20 negroblanco,adidas,209.31,calzado,ripley,ZAPATILLAS (HOMBRE >14),321010303,hombre
zapatillas hombre adidas running,adidas,207.99,calzado,ripley,ZAPATILLAS (HOMBRE >14),321010303,hombre
zapatos casuales hombre pierre cardin cuero neg,pierre cardin,329.0,calzado,ripley,ZAPATOS (HOMBRE >14),321010121,hombre
zapatillas hombre north star urbanas ns bosie,north star,118.93,calzado,ripley,ZAPATILLAS (HOMBRE >14),321010303,hombre
zapatilla adidas grand court base 20 hombre,adidas,189.9,calzado,ripley,ZAPATILLAS (HOMBRE >14),321010303,hombre
adidas zapatilla de hombre,adidas,278.0,calzado,ripley,ZAPATILLAS (HOMBRE >14),321010303,hombre
zapatillas deportivas para hombre power,power,101.94,calzado,ripley,ZAPATILLAS (HOMBRE >14),321010303,hombre
zapatos casuales hombre kaida cuero 23ci 09,kaida,197.0,calzado,ripley,ZAPATOS (HOMBRE >14),321010121,hombre
zapatos de vestir hombre steve madden dallas,steve madden,230.93,calzado,ripley,ZAPATOS (HOMBRE >14),321010121,hombre
zapatillas hombre pierre cardin urbanas cuero,pierre cardin,309.0,calzado,ripley,ZAPATILLAS (HOMBRE >14),321010303,hombre
zapatillas hombre puma urbanas palermo vintage,puma,300.99,calzado,ripley,ZAPATILLAS (HOMBRE >14),321010303,hombre
zapatillas hombre puma conduct pro,puma,329.99,calzado,ripley,ZAPATILLAS (HOMBRE >14),321010303,hombre
medias new balance las95123bk,new balance,39.9,calzado,ripley,CALCETINES (HOMBRE > 14),312010119,mujer
zapatos seguridad delta plus robion3 s2 src hombre,delta plus,354.0,calzado,ripley,ZAPATOS (HOMBRE >14),321010121,hombre
zapatillas hombre new balance deportivas marisyb4,new balance,189.9,calzado,ripley,ZAPATILLAS (HOMBRE >14),321010303,hombre
zapatillas hombre reebok casuales,reebok,209.99,calzado,ripley,ZAPATILLAS (HOMBRE >14),321010303,hombre
zapatillas hombre caterpillar urbanas,caterpillar,263.9,calzado,ripley,ZAPATILLAS (HOMBRE >14),321010303,hombre
zapatos de vestir hombre conters cuero bn,conters,224.0,calzado,ripley,ZAPATOS (HOMBRE >14),321010121,hombre
zapatillas hombre puma urbanas doublecourt,puma,230.99,calzado,ripley,ZAPATILLAS (HOMBRE >14),321010303,hombre
zapatilla adidas duramo rc u para hombre,adidas,189.0,calzado,ripley,ZAPATILLAS (HOMBRE >14),321010303,hombre
zapatillas hombre puma urbanas crema palermo cuero,puma,265.99,calzado,ripley,ZAPATILLAS (HOMBRE >14),321010303,hombre
zapatos casuales hombre ecco cuero ignacio01,ecco,169.9,calzado,ripley,ZAPATOS (HOMBRE >14),321010121,hombre
zapatos de vestir hombre cacharel cuero café africano,cacharel,129.9,calzado,ripley,ZAPATOS (HOMBRE >14),321010121,hombre
zapatos de vestir hombre dauss cuero marrón 3702a,dauss,179.4,calzado,ripley,ZAPATOS (HOMBRE >14),321010121,hombre
zapatillas hombre nike training mc trainer 3,nike,329.99,calzado,ripley,ZAPATILLAS (HOMBRE >14),321010303,hombre
zapatilla hombre reebok deportivas energen lux,reebok,131.99,calzado,ripley,ZAPATILLAS (HOMBRE >14),321010303,hombre
zapatillas hombre reebok urbanas atr chill cuero,reebok,279.99,calzado,ripley,ZAPATILLAS (HOMBRE >14),321010303,hombre
zapatillas futbol futsal adidas hombre goletto viii,adidas,179.99,calzado,ripley,ZAPATILLAS (HOMBRE >14),321010303,hombre
zapatillas hombre new balance urbanas u327ce,new balance,379.9,calzado,ripley,ZAPATILLAS (HOMBRE >14),321010303,hombre
zapatos de vestir hombre pierre cardin cuero,pierre cardin,299.0,calzado,ripley,ZAPATOS (HOMBRE >14),321010121,hombre
zapatillas hombre umbro deportivas 81900u lua,umbro,97.93,calzado,ripley,ZAPATILLAS (HOMBRE >14),321010303,hombre
zapatilla hombre umbro fútbol indoor 81899u,umbro,139.9,calzado,ripley,ZAPATILLAS (HOMBRE >14),321010303,hombre
zapatillas hombre nike fútbol pasto sintético phantom luna ii club tf,nike,329.99,calzado,ripley,ZAPATILLAS (HOMBRE >14),321010303,hombre
zapatillas hombre reebok casuales,reebok,199.99,calzado,ripley,ZAPATILLAS (HOMBRE >14),321010303,hombre
salida baño mujer bagus ava kaftan,bagus,79.99,mujer,ripley,NO CLASIFICACIÓN,0,mujer
faja colombiana mujer ann chery chocolate claro casandra reductora y moldeadora,ann chery,240.0,mujer,ripley,ROPA INTERIOR (MUJER > 14),312020172,mujer
pijama mujer lanna sleepwear tela viscosa y aplicaciones tull colombiano,lanna sleepwear,110.0,mujer,ripley,NO CLASIFICACIÓN,0,mujer
falda short mujer jarola mariana,jarola,129.0,mujer,ripley,PANTALÓN CORTO (MUJER > 14),312020136,mujer
mochila de playa con malla para niñoniña cool bags,cool bags,43.0,mujer,ripley,NO CLASIFICACIÓN,0,niño
body mujer alejandra baigorria tull plush party,alejandra baigorria,69.99,mujer,ripley,CONJUNTO / VESTIDO DE VESTIR (MUJER > 14),312020118,mujer
bolsa de lavado mujer leonisa con cierre y estructura en cada extremo,leonisa,29.9,mujer,ripley,NO CLASIFICACIÓN,0,mujer
bustier mujer alejandra baigorria jaqueline,alejandra baigorria,49.99,mujer,ripley,NO CLASIFICACIÓN,0,mujer
pack x3 pantaleta mujer palmers taupe encaje,palmers,49.9,mujer,ripley,ROPA INTERIOR (MUJER > 14),312020172,mujer
faja mujer fajas fajitex cachetera broche centro,fajas fajitex,280.0,mujer,ripley,ROPA INTERIOR (MUJER > 14),312020172,mujer
vestido algodón mujer calvin klein cd2g1q2w camisero logo tape,calvin klein,269.0,mujer,ripley,NO CLASIFICACIÓN,0,mujer
polera manga larga mujer levis everyday sweatshirt,levi's,153.3,mujer,ripley,"POLO (INCLUYE TIPO BIBIDI, TOPS, ETC.) (MUJER > 14)",312020142,mujer
vestido mini algodón mujer soda blues milety,soda blues,159.99,mujer,ripley,NO CLASIFICACIÓN,0,mujer
polera manga larga mujer pyt sweater,pyt,109.9,mujer,ripley,"POLO (INCLUYE TIPO BIBIDI, TOPS, ETC.) (MUJER > 14)",312020142,mujer
vestido corto mujer alejandra baigorria loma ale party,alejandra baigorria,87.99,mujer,ripley,NO CLASIFICACIÓN,0,mujer
camiseta manga larga mujer hurley licra negra rashguard,hurley,139.0,mujer,ripley,"POLO (INCLUYE TIPO BIBIDI, TOPS, ETC.) (MUJER > 14)",312020142,mujer
salida de playa o vestido tipo kaftan asha largo talla unica,permuta beachwear,190.0,mujer,ripley,NO CLASIFICACIÓN,0,mujer
body faja brasileña wonderful talla,wonderful,64.99,mujer,ripley,ROPA INTERIOR (MUJER > 14),312020172,mujer
falda corta algodón mujer index foco,index,49.99,mujer,ripley,NO CLASIFICACIÓN,0,mujer
falda short mujer alejandra baigorria loma,alejandra baigorria,49.99,mujer,ripley,PANTALÓN CORTO (MUJER > 14),312020136,mujer
vestido largo mujer mentha y chocolate joana,mentha y chocolate,209.3,mujer,ripley,NO CLASIFICACIÓN,0,mujer
vestido corto mujer index alicia,index,69.99,mujer,ripley,NO CLASIFICACIÓN,0,mujer
vestido largo mujer exit janusz,exit,113.4,mujer,ripley,NO CLASIFICACIÓN,0,mujer
vestido mini mujer soda blues lucian,soda blues,129.99,mujer,ripley,NO CLASIFICACIÓN,0,mujer
enterizo largo mujer mentha y chocolate laura,mentha y chocolate,269.0,mujer,ripley,CONJUNTO / VESTIDO DE VESTIR (MUJER > 14),312020118,mujer
short algodón mujer tommy hilfiger formal vichy,tommy hilfiger,159.0,mujer,ripley,PANTALÓN CORTO (MUJER > 14),312020136,mujer
short corto slim mujer leonisa deportivo ligero con cómodo elástico en cintura,leonisa,35.0,mujer,ripley,ROPA DEPORTIVA (MUJER > 14),312020168,mujer
faja post parto ultra powernet moldeador vicky talla,fajas post parto y cesárea,99.0,mujer,ripley,ROPA INTERIOR (MUJER > 14),312020172,mujer
faja mujer fajas fajitex senos libres con mangas,fajas fajitex,370.0,mujer,ripley,ROPA INTERIOR (MUJER > 14),312020172,mujer
pijama largo mujer in bloom culotte vichy skylight,in bloom,129.9,mujer,ripley,NO CLASIFICACIÓN,0,mujer
vestido midi mujer soda blues kensie,soda blues,129.99,mujer,ripley,NO CLASIFICACIÓN,0,mujer
faja colombiana mujer ann chery chocolate claro isabella post operatoria reductora y moldeadora,ann chery,290.0,mujer,ripley,ROPA INTERIOR (MUJER > 14),312020172,mujer
visera todo gorros peru running,todo gorros peru,28.9,mujer,ripley,NO CLASIFICACIÓN,0,mujer
blazer mujer john holden woman zoyla ce,john holden woman,319.92,mujer,ripley,NO CLASIFICACIÓN,0,mujer
falda larga mujer cacharel dorado fesatin,cacharel,111.99,mujer,ripley,NO CLASIFICACIÓN,0,mujer
short mujer index corto fútbol,index,30.0,mujer,ripley,PANTALÓN CORTO (MUJER > 14),312020136,mujer
salida baño mujer shop smart bricia,shop smart,166.41,mujer,ripley,NO CLASIFICACIÓN,0,mujer
traje de baño mujer cacharel escote,cacharel,129.99,mujer,ripley,NO CLASIFICACIÓN,0,mujer
peto algodón mujer palmers pack x 2,palmers,49.9,mujer,ripley,ROPA INTERIOR (NIÑA DE 3 A 13),312040165,mujer
vestido corto mujer index efeska,index,65.0,mujer,ripley,NO CLASIFICACIÓN,0,mujer
lenceria mujer ottoware hplus hot sexy plus size,ottoware,99.9,mujer,ripley,ROPA INTERIOR (MUJER > 14),312020172,mujer
bustier mujer alejandra baigorria yuli,alejandra baigorria,63.99,mujer,ripley,NO CLASIFICACIÓN,0,mujer
vestido midi mujer ilhabela abbie,ilhabela,239.9,mujer,ripley,NO CLASIFICACIÓN,0,mujer
gorro todo gorros peru fuck what people think,todo gorros peru,39.9,mujer,ripley,NO CLASIFICACIÓN,0,mujer
ropa baño mujer index top halter,index,39.99,mujer,ripley,NO CLASIFICACIÓN,0,mujer
pijama algodón mujer kayser marino,kayser,89.9,mujer,ripley,NO CLASIFICACIÓN,0,mujer
pantuflas mujer marquis open,marquis,34.9,mujer,ripley,SANDALIAS (MUJER > 14),321030115,mujer
cartera global shopex multicolor collsants para teléfono móvil pequeño,global shopex,159.0,mujer,ripley,NO CLASIFICACIÓN,0,mujer
bucket hat todo gorros peru chocolate,todo gorros peru,29.9,mujer,ripley,NO CLASIFICACIÓN,0,mujer
falda larga mujer marquis cruz,marquis,69.9,mujer,ripley,NO CLASIFICACIÓN,0,mujer
polera polar mujer billabong switchback sin cierre,billabong,189.0,mujer,ripley,"POLO (INCLUYE TIPO BIBIDI, TOPS, ETC.) (MUJER > 14)",312020142,mujer
falda corta mujer index abol,index,90.99,mujer,ripley,NO CLASIFICACIÓN,0,mujer
vestido maxi licra skinny mujer dshenk tulum,d`shenk,264.39,mujer,ripley,NO CLASIFICACIÓN,0,mujer
palmers boxer largo deportivo,palmers,79.9,mujer,ripley,ROPA DEPORTIVA (HOMBRE > 14),312010167,mujer
short regular mujer soda blues grisely,soda blues,109.99,mujer,ripley,PANTALÓN CORTO (MUJER > 14),312020136,mujer
pijama mujer index básico print,index,69.9,mujer,ripley,NO CLASIFICACIÓN,0,mujer
bucket hat fei fei lu,fei fei,59.0,mujer,ripley,NO CLASIFICACIÓN,0,mujer
sujetador mujer shein en forma de mariposa con lazo delantero con encaje,compra facil,48.9,mujer,ripley,ROPA INTERIOR (MUJER > 14),312020172,mujer
vestido largo ceñido mujer ilhabela celine,ilhabela,239.9,mujer,ripley,NO CLASIFICACIÓN,0,mujer
toalla linett bedding algodón 700gr,maison linett,49.99,mujer,ripley,NO CLASIFICACIÓN,0,mujer
enterizo mujer pepe jeans dolly,pepe jeans,105.0,mujer,ripley,CONJUNTO / VESTIDO DE VESTIR (MUJER > 14),312020118,mujer
short niño disney store mickey mouse adaptativo,disney store,98.9,mujer,ripley,NO CLASIFICACIÓN,0,niño
pack x4 pantaleta algodón mujer palmers,palmers,54.9,mujer,ripley,ROPA INTERIOR (MUJER > 14),312020172,mujer
short mujer calvin klein ladies active,calvin klein,109.0,mujer,ripley,PANTALÓN CORTO (MUJER > 14),312020136,mujer
vestido largo mujer tally weijl sdrviari,tally weijl,90.0,mujer,ripley,NO CLASIFICACIÓN,0,mujer
tiras jersey full lycra mujer runinx_s,squeeze,69.0,mujer,ripley,"POLO (INCLUYE TIPO BIBIDI, TOPS, ETC.) (MUJER > 14)",312020142,mujer
pack x2 petos sport teens p22gc palmers,palmers,49.9,mujer,ripley,ROPA INTERIOR (NIÑA DE 3 A 13),312040165,mujer
vestido midi ceñido mujer blackout auri,blackout,63.96,mujer,ripley,NO CLASIFICACIÓN,0,mujer
top algodón tommy jeans colorblock,tommy jeans,109.0,mujer,ripley,"POLO (INCLUYE TIPO BIBIDI, TOPS, ETC.) (MUJER > 14)",312020142,mujer
kayser trusa señorial algodón,kayser,36.9,mujer,ripley,ROPA INTERIOR (MUJER > 14),312020172,hombre
bata baño a la rodilla algodón mujer casablanca home,casablanca home,229.0,mujer,ripley,NO CLASIFICACIÓN,0,mujer
toalla ripley home algodón agua extrabaño 650gr,ripley home,79.99,mujer,ripley,NO CLASIFICACIÓN,0,mujer
sosten sin aro seamless,palmers,54.9,mujer,ripley,ROPA INTERIOR (MUJER > 14),312020172,mujer
gorra mujer peace and love oscuro,peace and love,45.0,mujer,ripley,NO CLASIFICACIÓN,0,mujer
camiseta manga corta mujer leonisa con cuello redondo y hombros caídos,leonisa,30.0,mujer,ripley,"POLO (INCLUYE TIPO BIBIDI, TOPS, ETC.) (MUJER > 14)",312020142,mujer
gorro todo gorros peru cruz plomo,todo gorros peru,39.9,mujer,ripley,NO CLASIFICACIÓN,0,mujer
falda corta algodón mujer index araceli,index,69.99,mujer,ripley,NO CLASIFICACIÓN,0,mujer
vestido corto mujer index francisca,index,30.0,mujer,ripley,NO CLASIFICACIÓN,0,mujer
falda mini mujer alejandra baigorria jeans paula ab juvenil,alejandra baigorria,59.99,mujer,ripley,NO CLASIFICACIÓN,0,mujer
vestido largo mujer navigata feiza estampado,navigata,75.0,mujer,ripley,NO CLASIFICACIÓN,0,mujer
toalla de playa con capucha disney minnie animal cm,disney,30.0,mujer,ripley,NO CLASIFICACIÓN,0,mujer
top manga corta mujer liola rayado off shoulder,liola,149.9,mujer,ripley,"POLO (INCLUYE TIPO BIBIDI, TOPS, ETC.) (MUJER > 14)",312020142,mujer
short mujer index analu,index,62.99,mujer,ripley,PANTALÓN CORTO (MUJER > 14),312020136,mujer
faja mujer caffarena,caffarena,99.0,mujer,ripley,ROPA INTERIOR (MUJER > 14),312020172,mujer
vestido midi lino mujer almat alessia camisero,almat,65.0,mujer,ripley,NO CLASIFICACIÓN,0,mujer
sujetador deportivo mujer compra facil shein espalda abierta con tira cruzada,compra facil,53.9,mujer,ripley,ROPA DEPORTIVA (MUJER > 14),312020168,mujer
pack x4 pantaleta algodón mujer palmers,palmers,54.9,mujer,ripley,ROPA INTERIOR (MUJER > 14),312020172,mujer
faja algodón mujer lee mark lm post operatoria quirúrgica postparto lipo,lee mark,49.0,mujer,ripley,ROPA INTERIOR (MUJER > 14),312020172,mujer
pijama niño micropolar,palmers,79.95,mujer,ripley,NO CLASIFICACIÓN,0,niño
pijama disney kayser mujer,kayser,119.9,mujer,ripley,NO CLASIFICACIÓN,0,mujer
gorro todo gorros peru corona,todo gorros peru,39.9,mujer,ripley,NO CLASIFICACIÓN,0,mujer
short mini recto mujer liola efecto cuero,liola,194.93,mujer,ripley,PANTALÓN CORTO (MUJER > 14),312020136,mujer
vestido corto mujer ilhabela claro gigi,ilhabela,159.9,mujer,ripley,NO CLASIFICACIÓN,0,mujer
polera franela mujer peace and love estampada,peace and love,89.0,mujer,ripley,"POLO (INCLUYE TIPO BIBIDI, TOPS, ETC.) (MUJER > 14)",312020142,mujer
vestido mujer tatienne largo ana,tatienne,90.99,mujer,ripley,NO CLASIFICACIÓN,0,mujer
falda short ceñido mujer bronco qorita drill,bronco,119.99,mujer,ripley,PANTALÓN CORTO (MUJER > 14),312020136,mujer
enterizo maxi rayón mujer soda blues marceriz,soda blues,179.99,mujer,ripley,CONJUNTO / VESTIDO DE VESTIR (MUJER > 14),312020118,mujer
pack x3 pantaleta microfibra mujer kayser rosado p,kayser,49.9,mujer,ripley,ROPA INTERIOR (MUJER > 14),312020172,mujer
vestido mujer pionier triana disney popelina,pionier,149.0,mujer,ripley,NO CLASIFICACIÓN,0,mujer
sweater mujer cacharel dordon,cacharel,49.99,mujer,ripley,"POLO (INCLUYE TIPO BIBIDI, TOPS, ETC.) (MUJER > 14)",312020142,mujer
vestido mujer index tejido,index,83.99,mujer,ripley,NO CLASIFICACIÓN,0,mujer
falda mujer alejandra baigorria angela,alejandra baigorria,59.99,mujer,ripley,NO CLASIFICACIÓN,0,mujer
crossbody global shopex multicolor clutch transparente acrílico box mujer estadio aprobado,global shopex,159.0,mujer,ripley,ROPA DEPORTIVA (MUJER > 14),312020168,mujer
tabla colombiana mujer md ta100md anatómica con protector de cintura extralarga,m&d,210.0,mujer,ripley,ROPA INTERIOR (MUJER > 14),312020172,mujer
enterizo largo mujer liola satin estampado,liola,279.9,mujer,ripley,CONJUNTO / VESTIDO DE VESTIR (MUJER > 14),312020118,mujer
pijama camisola algodón mujer pionier xerell disney,pionier,104.99,mujer,ripley,NO CLASIFICACIÓN,0,mujer
vestido largo ceñido mujer index devivo,index,85.0,mujer,ripley,NO CLASIFICACIÓN,0,mujer
blazer mujer marquis sun corto,marquis,150.0,mujer,ripley,NO CLASIFICACIÓN,0,mujer
pijama niña leonisa rosado manga larga y pantalón largo estampado,leonisa,139.9,mujer,ripley,NO CLASIFICACIÓN,0,niña
faja reductora unisex sport fitness fj cintura avispa modeladora unisex,sport fitness,35.0,mujer,ripley,ROPA INTERIOR (MUJER > 14),312020172,sin genero
pijama short algodón mujer marquis flores,marquis,59.99,mujer,ripley,PANTALÓN CORTO (MUJER > 14),312020136,mujer
polera franela para mujer sofia_disney,pionier,169.0,mujer,ripley,"POLO (INCLUYE TIPO BIBIDI, TOPS, ETC.) (NIÑA DE 3 A 13)",312040142,mujer
muñeca clásica disney princesa tiana,disney,189.0,moda infantil,ripley,NO CLASIFICACIÓN,0,mujer
disfraz niña disney multicolor minnie mouse vestido mini mouse 18 meses,disney,159.0,moda infantil,ripley,NO CLASIFICACIÓN,0,niña
pantalon pretina ancha con pie de algodón pima,mellow,34.9,moda infantil,ripley,CONJUNTITO (MENOR DE 2),312050138,mujer
vestido algodón bebé niña colloky rosado,colloky,83.4,moda infantil,ripley,NO CLASIFICACIÓN,0,niña
uniforme slytherin traje harry potter tallas 16 hasta,genérico,134.9,moda infantil,ripley,NO CLASIFICACIÓN,0,mujer
little chicks gorro turbante bebé niña algodón pima lila,little chicks,29.94,moda infantil,ripley,NO CLASIFICACIÓN,0,niña
osito baby harvest niña,baby harvest,40.0,moda infantil,ripley,NO CLASIFICACIÓN,0,niña
pack 2 sweater manga larga algodón niña disney frozen princesas,disney,109.0,moda infantil,ripley,"POLO (INCLUYE TIPO BIBIDI, TOPS, ETC.) (NIÑA DE 3 A 13)",312040142,niña
casaca manga larga unisex tifanti lacre peluche,tifanti,89.0,moda infantil,ripley,"CASACA, CHAQUETA, GUERRERA (NIÑA DE 3 A 13)",312040116,sin genero
chaqueta manga larga algodón niña colloky lila tricolor,colloky,55.68,moda infantil,ripley,"CASACA, CHAQUETA, GUERRERA (NIÑA DE 3 A 13)",312040116,niña
traje de baño niña harvest manga larga sirena vuelitos,harvest,48.99,moda infantil,ripley,NO CLASIFICACIÓN,0,niña
lentes de sol princesas disney,disney,85.0,moda infantil,ripley,NO CLASIFICACIÓN,0,mujer
polo niño gap original bebé talla 3 nezmun,gap,59.99,moda infantil,ripley,POLO (NIÑO DE 3 A 13),312030158,niño
polos luffy one piece peluche luffy talla 4 hasta,genérico,79.9,moda infantil,ripley,POLO (NIÑO DE 3 A 13),312030158,mujer
vestido poliéster para niña hello kitty,hello kitty,89.99,moda infantil,ripley,CONFECCIÓN DE VESTIDO (MUJER / NIÑA),312060230,niña
corbata harry potter hufflepuff,genérico,59.0,moda infantil,ripley,NO CLASIFICACIÓN,0,mujer
short algodón niña baby harvest papper,baby harvest,59.99,moda infantil,ripley,PANTALÓN (NIÑA DE 3 A 13),312040137,niña
jogger para bebita valentina,cottons jeans,25.0,moda infantil,ripley,PANTALÓN (NIÑA DE 3 A 13),312040137,mujer
ropa baño licra niña yowie perú ocean blossom one piece uv,yowie perú,130.0,moda infantil,ripley,NO CLASIFICACIÓN,0,niña
gorro bebé niña coral,pillin,45.43,moda infantil,ripley,NO CLASIFICACIÓN,0,niña
body básico manga corta de algodón pima,mellow,39.9,moda infantil,ripley,BEBECRECE (MENOR DE 2),312050108,mujer
pack body 3 piezas flores surtido,pillin,54.45,moda infantil,ripley,BEBECRECE (MENOR DE 2),312050108,mujer
set mochila sirenas agua lonchera y cartuchera sirenitas,generic,489.0,moda infantil,ripley,NO CLASIFICACIÓN,0,mujer
pantuflas niño shop disney marrón tipo botas con diseño cars on the road 5 años,shop disney,89.0,moda infantil,ripley,NO CLASIFICACIÓN,0,niño
short niño yonisters marrón car tafeta estampado semipitillo stretch kids,yonisters,49.99,moda infantil,ripley,NO CLASIFICACIÓN,0,niño
vestido bebé niña,pillin,65.34,moda infantil,ripley,NO CLASIFICACIÓN,0,niña
vestido muñeca disney princesa blanca nieves,disney,99.0,moda infantil,ripley,NO CLASIFICACIÓN,0,mujer
disfraz dinosaurio inflable t rex halloween carnaval,importado,179.0,moda infantil,ripley,NO CLASIFICACIÓN,0,mujer
body mini algodón orgánico bebé niño shop disney pesadilla antes de navidad de tim burton manga larga 18 a 24 meses,shop disney,80.0,moda infantil,ripley,BEBECRECE (MENOR DE 2),312050108,niño
ropa baño niña pepe jeans martha ii,pepe jeans,90.99,moda infantil,ripley,NO CLASIFICACIÓN,0,niña
vestido bebé niña c calzón,pillin,113.4,moda infantil,ripley,NO CLASIFICACIÓN,0,niña
set de joyas disney princesa jasmine,disney,159.0,moda infantil,ripley,NO CLASIFICACIÓN,0,mujer
polera manga larga algodón unisex adidas essentials bl hd,adidas,147.22,moda infantil,ripley,"POLO (INCLUYE TIPO BIBIDI, TOPS, ETC.) (NIÑA DE 3 A 13)",312040142,sin genero
mochila pañalera magia baby club chic,baby club chic,299.0,moda infantil,ripley,NO CLASIFICACIÓN,0,mujer
set figuras de lujo princesas disney,disney,259.0,moda infantil,ripley,NO CLASIFICACIÓN,0,mujer
set muñecas de lujo disney animator anna y elsa,disney,739.0,moda infantil,ripley,NO CLASIFICACIÓN,0,mujer
pijama niño pillin,pillin,63.2,moda infantil,ripley,NO CLASIFICACIÓN,0,niño
