Item,Marca,Precio,Categoria,Web,class_inei,codigo,genero
sandalia mujer felicina ,hush puppies,295.2,sandalias mujeres,falabella,SANDALIAS (MUJER > 14),321030115,mujer
abrigo acolchado para mujer   ,blwoens,199.0,moda mujer,falabella,"CASACA, CHAQUETA, GUERRERA (MUJER > 14)",312020114,mujer
camisa lino manga larga hombre,isague,84.0,moda hombre,falabella,CAMISA (HOMBRE > 14),312010124,hombre
gorro  algodón hombre,polo ralph lauren,229.9,gorros y sombreros,falabella,NO CLASIFICACIÓN,0,hombre
top lila mujer top corto,urpi dreams,39.98,moda mujer,falabella,"POLO (INCLUYE TIPO BIBIDI, TOPS, ETC.) (MUJER > 14)",312020142,mujer
polo oversize they killed kenny,generico,63.0,moda hombre,falabella,POLO (HOMBRE > 14),312010160,hombre
sandalias mujer   ,kolosh,107.94,sandalias mujeres,falabella,SANDALIAS (MUJER > 14),321030115,mujer
polos jersey niño emilio97,pionier,55.3,ropa de niños,falabella,POLO (NIÑO DE 3 A 13),312030158,niño
blusa niña algodón,mango kids,99.9,ropa de niños,falabella,"POLO (INCLUYE TIPO BIBIDI, TOPS, ETC.) (NIÑA DE 3 A 13)",312040142,niña
ballerinas ballerina mini plata para niña     ,bibi,143.9,zapatos niña,falabella,ZAPATOS (NIÑA DE 3 A 13),321040118,niña
gorro niño,doo australia,39.9,ropa de niños,falabella,NO CLASIFICACIÓN,0,niño
barra de cera peinado control de cabello unisex sin frizz baby hairs,generico,49.0,fajas y modeladores,falabella,NO CLASIFICACIÓN,0,sin genero
pack 3 medias deportivas niño rybiu,rybiu import,33.9,ropa de niños,falabella,CALCETINES (HOMBRE > 14),312010119,niño
jean algodón mujer,pionier,143.92,moda mujer,falabella,PANTALÓN (MUJER > 14),312020137,mujer
botas dama  burdeo,moleca,119.94,botas de mujer,falabella,BOTAS (MUJER > 14),321030106,mujer
reloj  ice cream detalles azules con luces,skmei,79.0,ropa de niñas,falabella,NO CLASIFICACIÓN,0,niña
zapatilla para hombre vapor 15 club tf  ,nike,279.9,zapatos,falabella,ZAPATILLAS (HOMBRE >14),321010303,hombre
zapatos de vestir mujer marietta,aldo,279.9,zapatos formales mujer,falabella,ZAPATOS (MUJER > 14),321030121,mujer
polo niña manga larga algodón gabbys dollhouse,la casa de gabby,23.94,ropa de niñas,falabella,"POLO (INCLUYE TIPO BIBIDI, TOPS, ETC.) (NIÑA DE 3 A 13)",312040142,niña
sandalia camel mujer ,gotta,169.0,sandalias mujeres,falabella,SANDALIAS (MUJER > 14),321030115,mujer
polo manga corta cars aventura sobre rueda,generico,39.9,moda hombre,falabella,"POLO (INCLUYE TIPO BIBIDI, TOPS, ETC.) (MUJER > 14)",312020142,hombre
botines nébula lier   camel,nebula,131.94,botines mujer,falabella,BOTAS (MUJER > 14),321030106,mujer
casual pre walker rosado,bibi,199.9,zapatos niña,falabella,ZAPATOS (NIÑA DE 3 A 13),321040118,niña
panty abrigador  p0030v01,v1422,59.9,moda mujer,falabella,ROPA INTERIOR (MUJER > 14),312020172,mujer
botines hombre botin cityrogue mid,cat,329.9,zapatos,falabella,ZAPATOS (HOMBRE >14),321010121,hombre
pack x2 cinta boob tape sujetador invisible,generico,34.9,sostenes,falabella,ROPA INTERIOR (MUJER > 14),312020172,mujer
body navideño   elegante,generico,35.9,ropa de bebe niño,falabella,BEBECRECE (MENOR DE 2),312050108,niño
pantalon cargo drill stretch mujer ioana,pionier,169.0,moda mujer,falabella,PANTALÓN (MUJER > 14),312020137,mujer
sandalias banda niña,redwood,19.9,zapatos niña,falabella,ZAPATOS (NIÑA DE 3 A 13),321040118,niña
medias largas algodón papá noel navidad,abnormal socks,15.9,ropa interior y pijamas,falabella,CALCETINES (HOMBRE > 14),312010119,mujer
gorra mlb los angeles dodgers 9fortya frame 196172861645,new era,129.95,gorros y sombreros,falabella,NO CLASIFICACIÓN,0,mujer
body bebé niña pack x2 algodón,minnie,49.9,ropa de bebe niño,falabella,BEBECRECE (MENOR DE 2),312050108,niña
camisa lima shirt slim fit atrani ,lima shirt co,135.0,moda hombre,falabella,CAMISA (HOMBRE > 14),312010124,hombre
zapatos casuales mujer   ,kolosh,113.94,zapatos casuales mujer,falabella,ZAPATOS (MUJER > 14),321030121,mujer
camisa lima shirt relaxed fit copacabana ,lima shirt co,99.0,moda hombre,falabella,CAMISA (HOMBRE > 14),312010124,hombre
zapatos de vestir mujer,calimod,309.0,zapatos formales mujer,falabella,ZAPATOS (MUJER > 14),321030121,mujer
zapatos casuales hombre,carusso,207.2,zapatos,falabella,ZAPATOS (HOMBRE >14),321010121,hombre
polo top mujer,sybilla,34.9,moda mujer,falabella,"POLO (INCLUYE TIPO BIBIDI, TOPS, ETC.) (MUJER > 14)",312020142,mujer
zapatillas hombres   39 44,r18,125.4,zapatos,falabella,ZAPATOS (HOMBRE >14),321010121,hombre
overol bebé niño algodón,oshkosh,119.9,ropa de bebe niño,falabella,CONJUNTITO (MENOR DE 2),312050138,niño
body bebé niño pack 3 pcs ,pillin,71.0,ropa de bebe niño,falabella,BEBECRECE (MENOR DE 2),312050108,niño
zapatillas outdoor   con  aqua hombre,new athletic,219.0,zapatos,falabella,ZAPATILLAS (HOMBRE >14),321010303,hombre
zapatitos para bebé   sandalias   marrón,generico,51.0,zapatos niño,falabella,ZAPATOS (MENOR DE 2),321050106,bebe
polo licra compresor azulino,generico,69.0,moda hombre,falabella,POLO (HOMBRE > 14),312010160,hombre
gorro y bufanda con pompón accesorios para bebés y niños rj ,minari,19.9,ropa de niñas,falabella,NO CLASIFICACIÓN,0,niño
zapatillas urbanas hombre  sp basic midcourt,aldo,279.9,zapatos,falabella,ZAPATILLAS (HOMBRE >14),321010303,hombre
short denim algodón hombre,jack&jones,199.9,moda hombre,falabella,PANTALÓN CORTO (HOMBRE > 14),312010153,hombre
zapatos de vestir mujer  ,vizzano,131.94,sandalias mujeres,falabella,ZAPATOS (MUJER > 14),321030121,mujer
zapatillas urbana vs pace 20    ,adidas,289.3,zapatos,falabella,ZAPATILLAS (HOMBRE >14),321010303,mujer
gorra trucker banda twenty one pilots 04,generico,45.0,gorros y sombreros,falabella,NO CLASIFICACIÓN,0,mujer
zapatillas urbanas hombre ferrari caven 20,puma,289.9,zapatos,falabella,ZAPATILLAS (HOMBRE >14),321010303,hombre
polo jersey hombre lyvan pionier,gzuck,55.3,moda hombre,falabella,POLO (HOMBRE > 14),312010160,hombre
bota con lengueta afuera y doble correa con hebilla 2035l 70  ,generico,139.0,botas de mujer,falabella,BOTAS (MUJER > 14),321030106,mujer
gorra trucker clasica banda cafe tacuba 03,generico,49.9,gorros y sombreros,falabella,NO CLASIFICACIÓN,0,mujer
buzo niño algodón,paw patrol,69.9,ropa de niños,falabella,ROPA DEPORTIVA ESCOLAR (NIÑO DE 3 A 13),312030167,niño
sandalias casuales plate thong,michael kors,300.3,sandalias mujeres,falabella,SANDALIAS (MUJER > 14),321030115,mujer
chompa  algodón hombre,cortefiel,219.9,moda hombre,falabella,CHOMPA / SUÉTER (HOMBRE > 14),312010138,hombre
sandalia yute  mujer ,gotta,219.0,sandalias mujeres,falabella,SANDALIAS (MUJER > 14),321030115,mujer
zapato derby casual angel  t  cuero,rabbit,159.9,zapatos niño,falabella,ZAPATOS ESCOLARES (NIÑO DE 3 A 13),321020118,niño
disfraz de princesa aurora bella duermiente para mujer,generico,125.0,batas,falabella,NO CLASIFICACIÓN,0,mujer
zapatilla bugs bunny 2ly  blancoverde,generico,169.9,zapatillas urbanas mujer,falabella,ZAPATILLAS (MUJER > 14),321030303,mujer
sacón legant hombre ,kaeroshy,115.0,moda hombre,falabella,"CASACA, CHAQUETA, GUERRERA (HOMBRE > 14)",312010132,hombre
zapatos de vestir hombre 23rb 34,conters,175.4,zapatos,falabella,ZAPATOS (HOMBRE >14),321010121,hombre
gorra mlb new york mets 9forty 719106169695,new era,119.95,gorros y sombreros,falabella,NO CLASIFICACIÓN,0,mujer
polo moda jersey hombre benoit looney,pionier,89.0,moda hombre,falabella,POLO (HOMBRE > 14),312010160,hombre
sandalia para mujer   ,sthef,95.0,sandalias mujeres,falabella,SANDALIAS (MUJER > 14),321030115,mujer
mocasines mujer lumber jack  cat,lumberjack,149.0,mocasines,falabella,CALCETINES (HOMBRE > 14),312010119,mujer
correa  oscuro con hebilla puente,generico,39.9,correas,falabella,CORREA (HOMBRE >14),313010115,mujer
conjunto para niños en jogger cargo,generico,99.9,ropa de niños,falabella,NO CLASIFICACIÓN,0,niño
zapatillas gabby y su casa de muñecas urbanas rosado niña,disney,173.0,zapatos niño,falabella,ZAPATILLAS (NIÑA DE 3 A 13),321040303,niña
traje kneeskin yingfa mujer pro iii,generico,249.9,moda mujer,falabella,ROPA DEPORTIVA (MUJER > 14),312020168,mujer
panty profesional medias latinas,generico,118.0,pantys,falabella,ROPA INTERIOR (MUJER > 14),312020172,mujer
gorra trucker clasica banda el cuarteto de nos 01,generico,49.9,gorros y sombreros,falabella,NO CLASIFICACIÓN,0,mujer
gorra de los angeles rams nfl 9fifty ,new era,149.9,gorros y sombreros,falabella,NO CLASIFICACIÓN,0,mujer
medias niña pack de 3 pares,yamp,19.9,ropa de niñas,falabella,NO CLASIFICACIÓN,0,niña
body navidad niño niña algodón,yamp,24.9,ropa de bebe niño,falabella,BEBECRECE (MENOR DE 2),312050108,niño
sandalias para pre escolar fn  27 35 adriana,footloose,85.0,zapatos niña,falabella,ZAPATOS ESCOLARES (NIÑA DE 3 A 13),321040121,niña
zapatos casuales mujer   ,kolosh,125.94,zapatos casuales mujer,falabella,ZAPATOS (MUJER > 14),321030121,mujer
pantalón casual mujer,newport,69.9,moda mujer,falabella,PANTALÓN (MUJER > 14),312020137,mujer
zapatillas grand court platfor para mujer   0,adidas,256.0,zapatillas urbanas mujer,falabella,ZAPATILLAS (MUJER > 14),321030303,mujer
medias cómodas niño pack 3 pares,rybiu import,33.9,ropa de niños,falabella,NO CLASIFICACIÓN,0,niño
camisa manga larga hombre,wolf&hank,169.9,moda hombre,falabella,CAMISA (HOMBRE > 14),312010124,hombre
polo manga corta   cholo peru,generico,34.9,moda hombre,falabella,POLO (HOMBRE > 14),312010160,hombre
polo hot wheels algodón  manga corta   talla 4 hasta ,generico,54.9,moda hombre,falabella,POLO (HOMBRE > 14),312010160,hombre
zapatillas urbanas step urban mix,clarks,399.9,zapatos,falabella,ZAPATILLAS (HOMBRE >14),321010303,mujer
zapatillas urbanas mujer baconita2  ,denimlab,89.95,zapatillas urbanas mujer,falabella,ZAPATILLAS (MUJER > 14),321030303,mujer
botines mildura   nébula   camel,nebula,137.94,botas de mujer,falabella,BOTAS (MUJER > 14),321030106,mujer
polo acid wash deadpool y wolverine heart,nacional,84.9,moda hombre,falabella,POLO (HOMBRE > 14),312010160,hombre
zapatos victoria para dama   ,generico,149.0,zapatos casuales mujer,falabella,ZAPATOS (MUJER > 14),321030121,mujer
camisa boxy manga corta hombre,isague,89.9,moda hombre,falabella,CAMISA (HOMBRE > 14),312010124,hombre
bota mujer hebilla y cremallera gamuza taco 7 2086l 70  ,generico,139.0,botas de mujer,falabella,BOTAS (MUJER > 14),321030106,mujer
vestido rip casual cafarena tcl 21  ,generico,49.99,moda mujer,falabella,VESTIDO PARA OCASIONES ESPECIALES (MUJER > 14),312020165,mujer
jeans hombre  slim taper ,levis,174.0,moda hombre,falabella,PANTALÓN (HOMBRE > 14),312010154,hombre
jean regular angel classic tall,cotton's jeans,79.91,moda hombre,falabella,PANTALÓN (HOMBRE > 14),312010154,hombre
polo okina  mujer,exit,83.3,moda mujer,falabella,"POLO (INCLUYE TIPO BIBIDI, TOPS, ETC.) (MUJER > 14)",312020142,mujer
sandalias para mujeres fch  35 40 malu,footloose,98.0,sandalias mujeres,falabella,SANDALIAS (MUJER > 14),321030115,mujer
medias alpaca afelpadas ideales para diabéticas y embarazadas,lancaster,27.0,medias,falabella,MEDIAS (MUJER > 14),312020131,mujer
chaqueta de cuero pu para hombre  ,blwoens,279.0,moda hombre,falabella,"CASACA, CHAQUETA, GUERRERA (HOMBRE > 14)",312010132,hombre
zapatillas running de hombre  91,apolo,114.5,zapatos,falabella,ZAPATILLAS (HOMBRE >14),321010303,hombre
sandalias summer roller light ,bibi,131.9,zapatos niño,falabella,ZAPATILLAS (NIÑO DE 3 A 13),321020303,niño
pack 3 medias algodón suave niño rybiu,rybiu import,33.9,ropa de niños,falabella,NO CLASIFICACIÓN,0,niño
polo urbano nation arequipa tm,generico,48.62,moda hombre,falabella,POLO (HOMBRE > 14),312010160,hombre
conjunto 2 piezas bebé niño,carter's,129.9,ropa de bebe niño,falabella,CONJUNTITO (MENOR DE 2),312050138,niño
sostén algodón mujer,dione,64.9,sostenes,falabella,ROPA INTERIOR (MUJER > 14),312020172,mujer
correa parisneg,tabu,34.9,correas,falabella,NO CLASIFICACIÓN,0,mujer
pezoneras de silicona invisibles,generico,12.0,sostenes,falabella,ROPA INTERIOR (MUJER > 14),312020172,mujer
faja laboral unisex talla ,leemark,42.0,fajas y modeladores,falabella,NO CLASIFICACIÓN,0,sin genero
sandalia peep toe vestir her  cobre cuero,viale,269.9,sandalias mujeres,falabella,SANDALIAS (MUJER > 14),321030115,mujer
camisa  lino hombre,la martina,249.9,moda hombre,falabella,CAMISA (HOMBRE > 14),312010124,hombre
pack 3 medias invisible   stitch,disney,18.9,medias,falabella,MEDIAS (MUJER > 14),312020131,mujer
zapato mocasin plataforma mujer kate cuero  agua,corelli,169.99,mocasines,falabella,ZAPATOS (MUJER > 14),321030121,mujer
zapatos julieta para dama   vino,generico,159.0,zapatos casuales mujer,falabella,ZAPATOS (MUJER > 14),321030121,mujer
zapatillas deportivas mujer deviate nitro elite 2 psychedelic rush wns ,puma,399.5,zapatillas deportivas mujer,falabella,ZAPATILLAS (MUJER > 14),321030303,mujer
zapatilla casual sport para hombre   rene,generico,118.0,zapatos,falabella,ZAPATILLAS (HOMBRE >14),321010303,hombre
bividi con bolsillo bÃ£sico de algodón ,yonisters clothing,29.9,moda hombre,falabella,POLO (HOMBRE > 14),312010160,hombre
body bebes dnuñez  enterizo  ansiedad,generico,34.9,ropa de bebe niño,falabella,BEBECRECE (MENOR DE 2),312050108,bebe
botin mujer camp 15  casual,chalada,149.9,botines mujer,falabella,BOTAS (MUJER > 14),321030106,mujer
zapatos de novia marca gardenia cueros  ivory tacón 7,generico,490.0,zapatos casuales mujer,falabella,ZAPATOS (MUJER > 14),321030121,mujer
jammer kids yingfa swimmer pro ii certificado fina,generico,219.9,ropa de niños,falabella,NO CLASIFICACIÓN,0,niño
polo uv niño manga larga,hot wheels,49.9,moda mujer,falabella,NO CLASIFICACIÓN,0,niño
faja dorso lumbar    ,generico,79.0,fajas y modeladores,falabella,NO CLASIFICACIÓN,0,mujer
vl court bold mujer ,adidas,272.0,zapatillas deportivas mujer,falabella,ZAPATILLAS (MUJER > 14),321030303,mujer
zapatos de vestir mujer coredith ,aldo,249.9,sandalias mujeres,falabella,SANDALIAS (MUJER > 14),321030115,mujer
ballerinas niña 20521507c bla ,molekinha,89.9,zapatos niña,falabella,ZAPATOS (NIÑA DE 3 A 13),321040118,niña
polo de pata daisy   ,forkids,70.0,ropa de niñas,falabella,"POLO (INCLUYE TIPO BIBIDI, TOPS, ETC.) (NIÑA DE 3 A 13)",312040142,niña
zapatillas urbanas niño royal cl jog 20 kc,reebok,149.0,zapatos niña,falabella,ZAPATILLAS (NIÑA DE 3 A 13),321040303,niño
jean wide algodón mujer,kansas,149.9,moda mujer,falabella,PANTALÓN (MUJER > 14),312020137,mujer
brasier brastop con buen cubrimiento de sisa y espalda,leonisa,119.0,sostenes,falabella,ROPA INTERIOR (MUJER > 14),312020172,mujer
pantalón culotte mujer,stefano cocci,77.94,moda mujer,falabella,PANTALÓN (MUJER > 14),312020137,mujer
zapatilla runfalcon 5  mujer,adidas,209.3,zapatillas urbanas mujer,falabella,ZAPATILLAS (MUJER > 14),321030303,mujer
zapatos casusales hombre asaria,aldo,279.9,zapatos,falabella,ZAPATOS (HOMBRE >14),321010121,hombre
botin para dama alia  apli plomo,bashira,195.0,zapatillas urbanas mujer,falabella,ZAPATILLAS (MUJER > 14),321030303,mujer
conjunto topbotton sostén y calzón v magic mujer,sicurezza,89.9,sostenes,falabella,ROPA INTERIOR (MUJER > 14),312020172,mujer
polo bulldog futbolista,generico,59.0,moda hombre,falabella,POLO (HOMBRE > 14),312010160,hombre
zapatillas urban turmalina de lona por cuero para mujer en contraste,velez,289.5,zapatillas urbanas mujer,falabella,ZAPATILLAS (MUJER > 14),321030303,mujer
pantalón slim hombre,dockers,269.9,moda hombre,falabella,PANTALÓN (HOMBRE > 14),312010154,hombre
camisa metropoli casual burdeo ml ,trial,153.3,moda hombre,falabella,CAMISA (HOMBRE > 14),312010124,hombre
blusa crop manga larga list,sybilla,59.94,moda mujer,falabella,BLUSA (MUJER > 14),312020106,mujer
botín plataforma camel mujer ,gotta,139.0,botines mujer,falabella,BOTAS (MUJER > 14),321030106,mujer
camisa ml robert ii camisero,bronco,143.91,moda hombre,falabella,CAMISA (HOMBRE > 14),312010124,hombre
vestido corto algodón mujer,mango,159.9,moda mujer,falabella,VESTIDO PARA OCASIONES ESPECIALES (MUJER > 14),312020165,mujer
gorra trucker clasica banda  label society 02,generico,49.9,gorros y sombreros,falabella,NO CLASIFICACIÓN,0,mujer
chaqueta casual hombre con sombrero ,knowmlab,159.0,moda hombre,falabella,"CASACA, CHAQUETA, GUERRERA (HOMBRE > 14)",312010132,hombre
botines licra mujer  crema,marglo shoes,182.32,botas de mujer,falabella,BOTAS (MUJER > 14),321030106,mujer
blusa manga larga mujer,fordan jeans,102.4,moda mujer,falabella,BLUSA (MUJER > 14),312020106,mujer
correa hombre,basement,49.9,correas,falabella,CORREA (HOMBRE >14),313010115,hombre
pantalon denim mujer aines,squeeze,169.0,moda mujer,falabella,PANTALÓN (MUJER > 14),312020137,mujer
cárdigan tejido   serena,generico,199.0,moda mujer,falabella,CHOMPA / SUÉTER (MUJER > 14),312020117,mujer
conjunto short polo bebé niña menta,pillin,174.9,ropa de niñas,falabella,CONJUNTITO (MENOR DE 2),312050138,niña
polo de disney    ,forkids,70.0,moda hombre,falabella,POLO (HOMBRE > 14),312010160,hombre
bvd de algodón rosado,red carrot,15.0,ropa de niñas,falabella,"POLO (INCLUYE TIPO BIBIDI, TOPS, ETC.) (NIÑA DE 3 A 13)",312040142,niña
tripack medias sport ,john holden,24.9,ropa interior y pijamas,falabella,CALCETINES (HOMBRE > 14),312010119,mujer
zapatos de tacón grueso para mujer,tiozoney,179.0,zapatos casuales mujer,falabella,ZAPATOS (MUJER > 14),321030121,mujer
pantalon jean strech ,generico,79.9,moda mujer,falabella,PANTALÓN (MUJER > 14),312020137,mujer
casaca de hombre damian,nancy's collection,119.0,moda hombre,falabella,"CASACA, CHAQUETA, GUERRERA (HOMBRE > 14)",312010132,hombre
balerinas muirne para dama   vino,generico,129.0,sandalias mujeres,falabella,SANDALIAS (MUJER > 14),321030115,mujer
casaca jean hera unisex ,generico,149.9,moda mujer,falabella,"CASACA, CHAQUETA, GUERRERA (MUJER > 14)",312020114,sin genero
mocasin vratsa     dorado,nebula,101.94,mocasines,falabella,ZAPATOS (MUJER > 14),321030121,mujer
corset portaligas lenceria,generico,89.9,calzones,falabella,ROPA INTERIOR (MUJER > 14),312020172,mujer
zapatillas urbanas mujer santa barbara,hoff,599.0,zapatillas urbanas mujer,falabella,ZAPATILLAS (MUJER > 14),321030303,mujer
zapatillas para niño  marino    ,molekinho,89.94,zapatos niño,falabella,ZAPATILLAS (NIÑO DE 3 A 13),321020303,niño
zapatillas urbanas suprime  claro hombre,north star,83.93,zapatos,falabella,ZAPATILLAS (MUJER > 14),321030303,hombre
botin casual de cuero para mujer parss  ,par&ss,187.8,botines mujer,falabella,BOTAS (MUJER > 14),321030106,mujer
casaca mujer,peace and love,99.0,moda mujer,falabella,"CASACA, CHAQUETA, GUERRERA (MUJER > 14)",312020114,mujer
bota mujer west 21  casual,chalada,249.9,botas de mujer,falabella,BOTAS (MUJER > 14),321030106,mujer
calzado deportivo informal calzado deportivo de moda para hombre,danweile,189.0,zapatos,falabella,ZAPATILLAS (HOMBRE >14),321010303,hombre
zapatillas urbanas niño skechers meteor lights,skechers,149.0,zapatos niño,falabella,ZAPATILLAS (NIÑO DE 3 A 13),321020303,niño
short con pinzas y lazo para niña   kids mahmelo,kids mashmelo,59.0,ropa de niñas,falabella,PANTALÓN (NIÑA DE 3 A 13),312040137,niña
tennis mujer roland 24  ,joma,430.0,zapatillas deportivas mujer,falabella,ZAPATILLAS (MUJER > 14),321030303,mujer
zapatillas running hombre  electron e pro,puma,329.9,zapatos,falabella,ZAPATILLAS (HOMBRE >14),321010303,hombre
chompa mujer hilo torquel trasluce  20  ,generico,39.0,moda mujer,falabella,CHOMPA / SUÉTER (MUJER > 14),312020117,mujer
zapatillas urbanas as core rosado,converse,179.9,zapatos niña,falabella,ZAPATILLAS (NIÑA DE 3 A 13),321040303,niña
chaqueta de pu para mujer marrón,blwoens,289.0,moda mujer,falabella,"CASACA, CHAQUETA, GUERRERA (MUJER > 14)",312020114,mujer
polera sin capucha peru carnaval,nacional,90.0,moda hombre,falabella,POLERA / SUDADERA (HOMBRE > 14),312010158,hombre
polo  de verano pack   6 unidades,generico,124.9,moda mujer,falabella,POLO (HOMBRE > 14),312010160,mujer
pijama baby yoda disfraz onesie unisex   tallas 4 al 14,generico,124.9,ropa de niñas,falabella,NO CLASIFICACIÓN,0,sin genero
 conjunto scrub corazón    vino,twelve,135.0,moda mujer,falabella,NO CLASIFICACIÓN,0,mujer
pantalon denim stretch mujer ainarah,pionier,189.0,moda mujer,falabella,PANTALÓN (MUJER > 14),312020137,mujer
polo reductor formador y  ultracompresión ginecomastia,oem,65.0,moda hombre,falabella,POLO (HOMBRE > 14),312010160,hombre
zapatilla negra mujer ,gotta,199.0,zapatillas urbanas mujer,falabella,ZAPATILLAS (MUJER > 14),321030303,mujer
zapatos niños fja  22 26 dellen,footloose,84.0,zapatos niño,falabella,ZAPATOS ESCOLARES (NIÑO DE 3 A 13),321020118,niño
zapatillas urbanas mujer palermo wns,puma,379.0,zapatillas urbanas mujer,falabella,ZAPATILLAS (MUJER > 14),321030303,mujer
zapatillas urbanas hombre corbainÂ  ,call it spring,169.9,zapatos,falabella,ZAPATOS (HOMBRE >14),321010121,hombre
camisa hombre original button up slim fit ,dockers,137.0,moda hombre,falabella,CAMISA (HOMBRE > 14),312010124,hombre
dclaude collection by desireÃ£   blusa mujer macarena   coral y perla,dclaude collection by desiree ruiz,21.9,moda mujer,falabella,BLUSA (MUJER > 14),312020106,mujer
sandalia mujer camila cuero planta pu no pesa 015l 58 hueso,generico,99.0,sandalias mujeres,falabella,SANDALIAS (MUJER > 14),321030115,mujer
botin para dama 11455c 70 emilia rotter ,generico,200.0,sandalias mujeres,falabella,SANDALIAS (MUJER > 14),321030115,mujer
zapatillas urbana mujer ,shandian,199.0,zapatillas deportivas mujer,falabella,ZAPATILLAS (MUJER > 14),321030303,mujer
gorro snap back unisex,umbro,35.0,gorros y sombreros,falabella,NO CLASIFICACIÓN,0,sin genero
traje de baño de mujer de esquina plana tirantes cruzados,zimrahyg,53.0,moda mujer,falabella,NO CLASIFICACIÓN,0,mujer
zapatilla hombre sb chron 2    ,nike,318.0,zapatos,falabella,ZAPATILLAS (HOMBRE >14),321010303,hombre
zapatillas courtflex v2 v ps  25 rosado para niña,puma,135.0,zapatos niña,falabella,ZAPATILLAS (NIÑA DE 3 A 13),321040303,niña
corrector de postura imantado inpesi no más joroba,generico,45.9,fajas y modeladores,falabella,NO CLASIFICACIÓN,0,mujer
vestido de niña ideal para fiesta,generico,191.9,ropa de niñas,falabella,NO CLASIFICACIÓN,0,niña
zapatilla revolution 7  ,nike,279.0,zapatos,falabella,ZAPATILLAS (HOMBRE >14),321010303,mujer
medias largas con diseño de donas ,generico,20.0,medias,falabella,CALCETINES (HOMBRE > 14),312010119,mujer
zapatillas urbanas hombre electron e,puma,219.9,zapatos,falabella,ZAPATILLAS (HOMBRE >14),321010303,hombre
correa unifaz gardenia de cuero para mujer pasador hexagonal,velez,174.3,correas,falabella,NO CLASIFICACIÓN,0,mujer
zapatillas dama  ,sthef,249.0,zapatillas urbanas mujer,falabella,ZAPATILLAS (MUJER > 14),321030303,mujer
vestido elegante con lazo y mangas abullonadas,moda by athena,95.0,ropa de niñas,falabella,NO CLASIFICACIÓN,0,niña
zapatilla moldavia   acero,nebula,101.94,zapatillas urbanas mujer,falabella,ZAPATILLAS (MUJER > 14),321030303,mujer
polo camisero tipo pique dorado ,aeropostale,129.9,moda hombre,falabella,POLO (HOMBRE > 14),312010160,hombre
polo navideño ,bernoulli,70.0,moda hombre,falabella,POLO (HOMBRE > 14),312010160,hombre
botines mujeres flk  35 39 venecia pu,footloose,168.0,botines mujer,falabella,BOTAS (MUJER > 14),321030106,mujer
gorro chicago bulls nba 9fifty ,new era,159.9,gorros y sombreros,falabella,NO CLASIFICACIÓN,0,mujer
bóxer corto elástico visible ,boston,21.9,ropa interior y pijamas,falabella,ROPA INTERIOR (HOMBRE > 14),312010171,mujer
vestido largo de verano palma con diseño exclusivo   talla ,kast pe,109.9,moda mujer,falabella,VESTIDO PARA OCASIONES ESPECIALES (MUJER > 14),312020165,mujer
polo manga corta henley el sofisticado   olivo,rising dragon,75.65,moda hombre,falabella,POLO (HOMBRE > 14),312010160,hombre
zapatillas urbanas niño mickey ,mickey mouse,139.9,zapatos niño,falabella,ZAPATILLAS (NIÑO DE 3 A 13),321020303,niño
polo anime jujutsu kaisen   kento nanami,generico,44.9,moda hombre,falabella,POLO (HOMBRE > 14),312010160,hombre
vestido pepa para niña,generico,99.9,ropa de niñas,falabella,"POLO (INCLUYE TIPO BIBIDI, TOPS, ETC.) (NIÑA DE 3 A 13)",312040142,niña
botines  ,sthef,153.0,botines mujer,falabella,BOTAS (MUJER > 14),321030106,mujer
sandalia casual mujer icangry2 az,stefano cocci,59.9,sandalias mujeres,falabella,SANDALIAS (MUJER > 14),321030115,mujer
correa unifaz de cuero pasadores,velez,135.2,correas,falabella,NO CLASIFICACIÓN,0,mujer
bralette sin costura,generico,35.0,sostenes,falabella,ROPA INTERIOR (MUJER > 14),312020172,mujer
zapatillas de entrenamiento de baloncesto de caña alta   ,danweile,239.0,zapatos,falabella,ZAPATILLAS (HOMBRE >14),321010303,mujer
conjunto dos piezas lino mujer,mood,120.0,moda mujer,falabella,NO CLASIFICACIÓN,0,mujer
pack conjunto de lencería de encaje    ,generico,109.99,calzones,falabella,ROPA INTERIOR (MUJER > 14),312020172,mujer
running hombre titanium 24 royal,joma,287.2,zapatos,falabella,ZAPATILLAS (HOMBRE >14),321010303,hombre
medias baby alpaca extra suave,alpachany,44.84,medias,falabella,CALCETINES (HOMBRE > 14),312010119,mujer
taco mujer bumblebee 2086l 55 taco 9  rosado,generico,99.0,sandalias mujeres,falabella,ZAPATOS (MUJER > 14),321030121,mujer
zapato casual mujer eden loafer dorado,michael kors,559.2,zapatos casuales mujer,falabella,ZAPATOS (MUJER > 14),321030121,mujer
zapatillas deportivas hombre gel dedicate 8 clay whiteblue,asics,449.9,zapatos,falabella,ZAPATILLAS (HOMBRE >14),321010303,hombre
tenis cooper 3 de cuero para hombre spoiler en contraste,velez,709.0,zapatos,falabella,ZAPATILLAS (HOMBRE >14),321010303,hombre
zapatillas running mujer runita rosado,fratta,65.94,zapatillas deportivas mujer,falabella,ZAPATILLAS (MUJER > 14),321030303,mujer
polo manga larga niño,sonic,19.9,ropa de niños,falabella,POLO (NIÑO DE 3 A 13),312030158,niño
brasier push up invisible ,generico,17.0,pantys,falabella,ROPA INTERIOR (MUJER > 14),312020172,mujer
