Item,Marca,Precio,Categoria,Web,class_inei,codigo,genero
blusa manga larga denim mujer squeeze  lably moda,squeeze,169.0,mujer,ripley,BLUSA (MUJER > 14),312020106,mujer
camisa hombre oscar de la renta  b2102wvn900,oscar de la renta,179.99,hombre,ripley,CAMISA (HOMBRE > 14),312010124,hombre
polera hombre fox full stop pullover,fox,100.0,hombre,ripley,POLERA / SUDADERA (HOMBRE > 14),312010158,hombre
zapatilla sport amber 20 para mujer   vino,sport fitness,69.0,calzado,ripley,ZAPATILLAS (MUJER > 14),321030303,mujer
polo manga corta mujer cacharel crudo ecarmen,cacharel,39.99,mujer,ripley,"POLO (INCLUYE TIPO BIBIDI, TOPS, ETC.) (MUJER > 14)",312020142,mujer
zapatillas hombre us polo assn urbanas usjsh 55  a,us polo assn,159.99,calzado,ripley,ZAPATILLAS (HOMBRE >14),321010303,hombre
camiseta hombre new balance mt41222nus,new balance,79.99,calzado,ripley,CAMISA (HOMBRE > 14),312010124,hombre
camisa manga larga algodón hombre lacoste,lacoste,499.0,hombre,ripley,CAMISA (HOMBRE > 14),312010124,hombre
polera manga larga hombre nation store trujillo tm,nation store,91.89,hombre,ripley,POLERA / SUDADERA (HOMBRE > 14),312010158,hombre
polo manga corta mujer tally weijl stscoperipa2,tally weijl,39.99,mujer,ripley,"POLO (INCLUYE TIPO BIBIDI, TOPS, ETC.) (MUJER > 14)",312020142,mujer
polo manga corta hombre drsk peru good friends tie dye,drsk peru,65.0,hombre,ripley,POLO (HOMBRE > 14),312010160,hombre
polera crew  bebe niña damasco,pillin,44.5,moda infantil,ripley,BEBECRECE (MENOR DE 2),312050108,mujer
enterizo fit niña   hade gl 28,genérico,49.99,moda infantil,ripley,BEBECRECE (MENOR DE 2),312050108,niña
jeans flare mujer pionier sabry new,pionier,129.99,mujer,ripley,PANTALÓN (MUJER > 14),312020137,mujer
zapatillas hombre vans urbanas  vn0007ntbgk,vans,199.0,calzado,ripley,ZAPATILLAS (HOMBRE >14),321010303,hombre
conjunto mini algodón niña lalala  ballet traje 2 intems falda envolvente,lalala,89.0,moda infantil,ripley,CONJUNTITO (MENOR DE 2),312050138,niña
guantes ansell 11   hiflex lite palma pu cut 3 1 par,ansell,49.0,hombre,ripley,CALCETINES (HOMBRE > 14),312010119,hombre
jean algodón recto mujer squeeze iniet,squeeze,159.99,mujer,ripley,PANTALÓN (MUJER > 14),312020137,mujer
polo manga corta algodón atp fit kaeroshy oversize,atp,29.0,hombre,ripley,POLO (HOMBRE > 14),312010160,hombre
polera hombre tapout tolex,tapout,119.9,hombre,ripley,POLERA / SUDADERA (HOMBRE > 14),312010158,hombre
pijama hombre navigata polar,navigata,79.99,hombre,ripley,ROPA INTERIOR (HOMBRE > 14),312010171,hombre
chaleco hombre masserano  chlco  sellado thermico impermiable,masserano,100.0,hombre,ripley,ROPA DEPORTIVA (HOMBRE > 14),312010167,hombre
polo manga larga mujer liola básica ribb botón joya básico,liola,159.99,mujer,ripley,"POLO (INCLUYE TIPO BIBIDI, TOPS, ETC.) (MUJER > 14)",312020142,mujer
botines mujer footloose  ac  35 39 arya,footloose,152.0,calzado,ripley,BOTAS (MUJER > 14),321030106,mujer
jardinera largo niña harvest  acero boho,harvest,99.99,moda infantil,ripley,PANTALÓN (NIÑA DE 3 A 13),312040137,niña
blusa mujer cacharel manga 34 barco,cacharel,54.99,mujer,ripley,BLUSA (MUJER > 14),312020106,mujer
jean culotte mujer pionier witbera lyocell,pionier,149.99,mujer,ripley,PANTALÓN (MUJER > 14),312020137,mujer
polo bebé niña damasco,pillin,45.54,moda infantil,ripley,"POLO (INCLUYE TIPO BIBIDI, TOPS, ETC.) (NIÑA DE 3 A 13)",312040142,mujer
polo manga corta niño maui and sons,maui and sons,39.9,moda infantil,ripley,POLO (NIÑO DE 3 A 13),312030158,niño
enterizo corto bebe niño jeans,pillin,48.95,moda infantil,ripley,CONJUNTITO (MENOR DE 2),312050138,niño
vestido mujer doomine grace denim jean stretch,doomine,139.99,mujer,ripley,VESTIDO PARA OCASIONES ESPECIALES (MUJER > 14),312020165,mujer
pantalón mujer marquis,marquis,90.0,mujer,ripley,PANTALÓN (MUJER > 14),312020137,mujer
overall straight index niña,index,95.0,moda infantil,ripley,PANTALÓN (NIÑA DE 3 A 13),312040137,niña
conjunto buzo mujer maja  claro,maja,99.0,mujer,ripley,CONJUNTO / VESTIDO DE VESTIR (MUJER > 14),312020118,mujer
zapatillas hombre puma urbanas  marino capri royale,puma,191.99,calzado,ripley,ZAPATILLAS (HOMBRE >14),321010303,hombre
polera hombre hurley one and only suelto,hurley,90.0,hombre,ripley,POLERA / SUDADERA (HOMBRE > 14),312010158,hombre
zapatillas   para mujer laline,dvx,169.0,calzado,ripley,ZAPATILLAS (MUJER > 14),321030303,mujer
polo manga corta algodón mujer esprit 994ee1k321,esprit,49.99,mujer,ripley,"POLO (INCLUYE TIPO BIBIDI, TOPS, ETC.) (MUJER > 14)",312020142,mujer
blusa manga larga mujer john holden woman wallece,john holden woman,149.9,mujer,ripley,BLUSA (MUJER > 14),312020106,mujer
pijama camiseta mujer caffarena,caffarena,44.9,mujer,ripley,ROPA INTERIOR (MUJER > 14),312020172,mujer
zapatilla mujer under armour deportivas,under armour,139.99,calzado,ripley,ZAPATILLAS (MUJER > 14),321030303,mujer
jeans tobillero skinny mujer metal jeans fantasy mood cb,metal jeans,69.99,mujer,ripley,PANTALÓN (MUJER > 14),312020137,mujer
camiseta algodón hombre calvin klein  3 pack cotton classics v neck,calvin klein,151.92,hombre,ripley,CAMISA (HOMBRE > 14),312010124,hombre
jean niño pepe jeans cargo,pepe jeans,89.9,moda infantil,ripley,PANTALÓN (NIÑO DE 3 A 13),312030150,niño
jean slim hombre levis,levi's,249.0,hombre,ripley,PANTALÓN (HOMBRE > 14),312010154,hombre
sandalias mujer gotta fucsia taco,gotta,89.0,calzado,ripley,SANDALIAS (MUJER > 14),321030115,mujer
zapatos casuales hombre kaida cuero  22mt 04,kaida,177.6,calzado,ripley,ZAPATOS (HOMBRE >14),321010121,hombre
zapatilla cali   nébula   rosado,nébula,79.95,calzado,ripley,ZAPATILLAS (MUJER > 14),321030303,mujer
vestido niña urpi imports rosado casual  saco cuerina,urpi imports,175.0,moda infantil,ripley,CONJUNTITO (MENOR DE 2),312050138,niña
pantalón buzo jogger el partner hombre,rising dragon,129.0,hombre,ripley,PANTALÓN (HOMBRE > 14),312010154,hombre
abrigo lana mujer only alpaca ciara merino,only alpaca,900.0,mujer,ripley,"CASACA, CHAQUETA, GUERRERA (MUJER > 14)",312020114,mujer
polo manga corta algodón hombre cloudbreak  emesa,cloudbreak,29.99,hombre,ripley,POLO (HOMBRE > 14),312010160,hombre
zapatos de vestir hombre steve madden   carter,steve madden,209.93,calzado,ripley,ZAPATOS (HOMBRE >14),321010121,hombre
falda mujer pepe jeans corta tara,pepe jeans,85.0,mujer,ripley,VESTIDO PARA OCASIONES ESPECIALES (MUJER > 14),312020165,mujer
sandalias mujer footloose vino fch  jana,footloose,84.0,calzado,ripley,SANDALIAS (MUJER > 14),321030115,mujer
polera manga larga hombre nautica,nautica,195.0,hombre,ripley,POLERA / SUDADERA (HOMBRE > 14),312010158,hombre
calza bebé niña estampada jacinto,pillin,38.94,moda infantil,ripley,BEBECRECE (MENOR DE 2),312050108,niña
pantalón mujer index cargo,index,85.0,mujer,ripley,PANTALÓN (MUJER > 14),312020137,mujer
zapatillas running niña nike varsity leather,nike,199.99,calzado,ripley,ZAPATILLAS (NIÑA DE 3 A 13),321040303,niña
bividí algodón hombre riffraff boi,riff&raff,41.94,hombre,ripley,ROPA INTERIOR (HOMBRE > 14),312010171,hombre
blusa manga larga mujer aziz abeja,aziz,54.99,mujer,ripley,BLUSA (MUJER > 14),312020106,mujer
zapatos casuales mujer suvenir biocuero  mate merlina premiun,suvenir,129.0,calzado,ripley,ZAPATOS (MUJER > 14),321030121,mujer
polo mujer pepe jeans manga corta mara,pepe jeans,39.99,mujer,ripley,"POLO (INCLUYE TIPO BIBIDI, TOPS, ETC.) (MUJER > 14)",312020142,mujer
cartera ziol,ziol,129.0,calzado,ripley,NO CLASIFICACIÓN,0,mujer
sandalias hombre bata  casuales,bata,87.92,calzado,ripley,ZAPATOS (HOMBRE >14),321010121,hombre
zapatos de vestir hombre kenneth cole  rsm4630am,kenneth cole,139.93,calzado,ripley,ZAPATOS (HOMBRE >14),321010121,hombre
falda larga suelto mujer alejandra baigorria lizet,alejandra baigorria,59.99,mujer,ripley,VESTIDO PARA OCASIONES ESPECIALES (MUJER > 14),312020165,mujer
pijama niño interlock,palmers,79.95,mujer,ripley,ROPA INTERIOR (NIÑO DE 3 A 13),312030169,niño
sweater niña index,index,59.9,moda infantil,ripley,"CASACA, CHAQUETA, GUERRERA (NIÑA DE 3 A 13)",312040116,niña
polo hombre hurley explore,hurley,99.99,hombre,ripley,POLO (HOMBRE > 14),312010160,hombre
camisa hombre ss classic 1 pkt standrd  levis,levi's,125.0,hombre,ripley,CAMISA (HOMBRE > 14),312010124,hombre
legging training match,tapout,59.9,hombre,ripley,PANTALÓN (MUJER > 14),312020137,hombre
ropa baño mujer index top off print,index,39.99,mujer,ripley,ROPA INTERIOR (MUJER > 14),312020172,mujer
polo unisex mattel 6974792_4136 barbie the movie logo  tee,mattel,275.0,hombre,ripley,POLO (HOMBRE > 14),312010160,sin genero
pijama manga corta mujer marquis acero oversize,marquis,49.99,mujer,ripley,ROPA INTERIOR (MUJER > 14),312020172,mujer
botines niña rabbit cuero marrón casual yadira  tabaco,rabbit,94.95,calzado,ripley,ZAPATOS (NIÑA DE 3 A 13),321040118,niña
zapatillas niño colloky urbanas   caminante,colloky,125.3,calzado,ripley,ZAPATILLAS (NIÑO DE 3 A 13),321020303,niño
polera niño woallance british,woallance,38.97,moda infantil,ripley,POLERA / SUDADERA (HOMBRE > 14),312010158,niño
jeans bebé niña,pillin,91.74,moda infantil,ripley,PANTALÓN (MENOR DE 2),312050152,niña
bucket hat fei fei dots,fei fei,49.0,mujer,ripley,ROPA DEPORTIVA (MUJER > 14),312020168,mujer
zapatillas running adidas mujer duramo sl,adidas,183.99,calzado,ripley,ZAPATILLAS (MUJER > 14),321030303,mujer
conjunto  bebé polo short barco,genérico,49.9,moda infantil,ripley,CONJUNTITO (MENOR DE 2),312050138,bebe
polo manga larga hombre tapout soyun capucha,tapout,69.9,hombre,ripley,POLO (HOMBRE > 14),312010160,hombre
ballerinas niña cruzato cuero rosado rrbb,cruzato,81.0,calzado,ripley,ZAPATOS (NIÑA DE 3 A 13),321040118,niña
jean recto mujer denizen  sculpt hr straight,denizen,89.5,mujer,ripley,PANTALÓN (MUJER > 14),312020137,mujer
sandalias mujer modare  71871002752097016,modare,97.93,calzado,ripley,SANDALIAS (MUJER > 14),321030115,mujer
polo pique bebelú para bebé niño,bebelú,30.0,moda infantil,ripley,POLO (NIÑO DE 3 A 13),312030158,niño
gorra aldodón league caps  los ángeles dodgers,league caps,69.9,hombre,ripley,ROPA DEPORTIVA (HOMBRE > 14),312010167,hombre
pijama midi algodón pima mujer in bloom  pj boyfriend,in bloom,229.9,mujer,ripley,ROPA INTERIOR (MUJER > 14),312020172,mujer
enterizo algodón niño baby club chic perla volando mi cometa,baby club chic,84.5,moda infantil,ripley,CONJUNTO / VESTIDO DE VESTIR (MUJER > 14),312020118,niño
polo hombre ss original hm tee  levis,levi's,149.0,hombre,ripley,POLO (HOMBRE > 14),312010160,hombre
blusa algodón mujer exit jaqueline,exit,74.5,mujer,ripley,BLUSA (MUJER > 14),312020106,mujer
zapatilla mendoza   rosado,nébula,79.95,calzado,ripley,ZAPATILLAS (MUJER > 14),321030303,mujer
falda niña index skort,index,89.9,moda infantil,ripley,VESTIDO PARA OCASIONES ESPECIALES (MUJER > 14),312020165,niña
polo mujer soda blues wenddy,soda blues,79.99,mujer,ripley,"POLO (INCLUYE TIPO BIBIDI, TOPS, ETC.) (MUJER > 14)",312020142,mujer
sweater niña index,index,29.99,moda infantil,ripley,"POLO (INCLUYE TIPO BIBIDI, TOPS, ETC.) (MUJER > 14)",312020142,niña
polo manga corta algodón para hombre dunkelvolk positive vibes,dunkelvolk,79.99,hombre,ripley,POLO (HOMBRE > 14),312010160,hombre
zapatillas hombre new balance urbanas marrón mr530snd,new balance,419.9,calzado,ripley,ZAPATILLAS (HOMBRE >14),321010303,hombre
blusa manga larga mujer esprit 103ee1f341,esprit,100.0,mujer,ripley,BLUSA (MUJER > 14),312020106,mujer
polo manga corta algodón mujer squeeze neirinn,squeeze,48.99,mujer,ripley,"POLO (INCLUYE TIPO BIBIDI, TOPS, ETC.) (MUJER > 14)",312020142,mujer
sandalias infantil niño colloky,colloky,104.3,calzado,ripley,ZAPATILLAS (NIÑO DE 3 A 13),321020303,niño
short hombres      dynamic air,r18,57.6,hombre,ripley,PANTALÓN CORTO (HOMBRE > 14),312010153,hombre
polo niña pionier happili  moda jersey,pionier,59.0,moda infantil,ripley,"POLO (INCLUYE TIPO BIBIDI, TOPS, ETC.) (NIÑA DE 3 A 13)",312040142,niña
enterizo algodón shop disney  mickey mouse manga corta bebés niños,shop disney,69.0,moda infantil,ripley,BEBECRECE (MENOR DE 2),312050108,niño
sandalias mujer gotta animal print plataforma,gotta,89.0,calzado,ripley,SANDALIAS (MUJER > 14),321030115,mujer
gorro maui and sons,maui and sons,39.9,hombre,ripley,ROPA DEPORTIVA (HOMBRE > 14),312010167,hombre
panty niña little chicks lila gruesa invierno,little chicks,35.94,moda infantil,ripley,ROPA INTERIOR (NIÑA DE 3 A 13),312040165,niña
casaca hombre elenex adem,elenex,149.9,hombre,ripley,"CASACA, CHAQUETA, GUERRERA (HOMBRE > 14)",312010132,hombre
pantalón urbano slim mujer adidas  lin leg,adidas,71.72,hombre,ripley,PANTALÓN (MUJER > 14),312020137,mujer
camisa manga larga algodón hombre maui and sons multicolor,maui and sons,179.9,hombre,ripley,CAMISA (HOMBRE > 14),312010124,hombre
sostén algodón mujer kayser rosado  rosb,kayser,49.9,mujer,ripley,ROPA INTERIOR (MUJER > 14),312020172,mujer
pantalón casual slim hombre next up  moda drill jaco rengifo topo,next up,100.15,hombre,ripley,PANTALÓN (HOMBRE > 14),312010154,hombre
zapatillas niña puma urbanas rosado rebound v6 lo ac ps,puma,89.95,calzado,ripley,ZAPATILLAS (NIÑA DE 3 A 13),321040303,niña
abrigo mujer pionier darsy,pionier,179.99,mujer,ripley,"CASACA, CHAQUETA, GUERRERA (MUJER > 14)",312020114,mujer
zapatilla adidas  terrex eastrail 2 rrdy w mujer,adidas,303.92,calzado,ripley,ZAPATILLAS (MUJER > 14),321030303,mujer
pantalón hombre john holden,john holden,189.9,hombre,ripley,PANTALÓN (HOMBRE > 14),312010154,hombre
sostén algodón mujer palmers multicolor p32027422234b pack 3,palmers,79.9,mujer,ripley,ROPA INTERIOR (MUJER > 14),312020172,mujer
sandalias mujer steve madden dorado,steve madden,258.93,calzado,ripley,SANDALIAS (MUJER > 14),321030115,mujer
camisaco drill para hombre doxy,xero tolerance,249.0,hombre,ripley,"CASACA, CHAQUETA, GUERRERA (HOMBRE > 14)",312010132,hombre
zapatilla hombre reebok deportivas,reebok,207.99,calzado,ripley,ZAPATILLAS (HOMBRE >14),321010303,hombre
polo sin mangas mujer index elisa,index,34.99,mujer,ripley,"POLO (INCLUYE TIPO BIBIDI, TOPS, ETC.) (MUJER > 14)",312020142,mujer
conjunto bebé niña pillin  23 coral,pillin,90.3,moda infantil,ripley,CONJUNTITO (MENOR DE 2),312050138,niña
pack 4 bóxers hombre reebok performance brief,reebok,139.0,hombre,ripley,ROPA INTERIOR (HOMBRE > 14),312010171,hombre
jean algodón recto mujer levis,levi's,299.0,mujer,ripley,PANTALÓN (MUJER > 14),312020137,mujer
chompa mujer pionier america hilos,pionier,116.1,mujer,ripley,CHOMPA / SUÉTER (MUJER > 14),312020117,mujer
medias pack x3 algodón ckm221cr04002 calvin klein para hombre,calvin klein,103.92,hombre,ripley,ROPA INTERIOR (HOMBRE > 14),312010171,hombre
pantalón flare mujer soda blues  gaelan,soda blues,149.99,mujer,ripley,PANTALÓN (MUJER > 14),312020137,mujer
polo autolistada,pillin,32.45,moda infantil,ripley,POLO (HOMBRE > 14),312010160,mujer
zapatos casuales mujer magdalena shoes  lazo mules,magdalena shoes,69.0,calzado,ripley,ZAPATOS (MUJER > 14),321030121,mujer
polo manga corta hombre nautica  oscuro,nautica,149.99,hombre,ripley,POLO (HOMBRE > 14),312010160,hombre
leggin running mujer new balance wp41177bk nb sleek high rise sport 25,new balance,188.99,calzado,ripley,PANTALÓN (MUJER > 14),312020137,mujer
zapatilla mujer reebok deportivas  energen lite,reebok,153.99,calzado,ripley,ZAPATILLAS (MUJER > 14),321030303,mujer
polo manga corta algodón niño cloudbreak solido,cloudbreak,34.99,moda infantil,ripley,POLO (NIÑO DE 3 A 13),312030158,niño
zapatilla unisex adidas running  response runner shoes,adidas,151.99,calzado,ripley,ZAPATILLAS (HOMBRE >14),321010303,sin genero
pantalón slim hombre dockers  jean cut,dockers,153.3,hombre,ripley,PANTALÓN (HOMBRE > 14),312010154,hombre
zapatillas mujer reebok urbanas rosado club c revenge vintage cuero,reebok,175.0,calzado,ripley,ZAPATILLAS (MUJER > 14),321030303,mujer
esquiladora manual para ovejas alpacas 31cm,genérico,29.0,moda infantil,ripley,NO CLASIFICACIÓN,0,mujer
blusa manga larga niña pionier celinaa,pionier,83.99,moda infantil,ripley,"POLO (INCLUYE TIPO BIBIDI, TOPS, ETC.) (NIÑA DE 3 A 13)",312040142,niña
pantalón regular mujer tally weijl spaliikaria,tally weijl,110.0,mujer,ripley,PANTALÓN (MUJER > 14),312020137,mujer
zapatillas casual skechers marble sweetheart multicolor,skechers,296.1,calzado,ripley,ZAPATILLAS (MUJER > 14),321030303,mujer
falda mujer midi  levis,levi's,160.0,mujer,ripley,VESTIDO PARA OCASIONES ESPECIALES (MUJER > 14),312020165,mujer
polo manga larga algodón hombre hurley hz233t05301,hurley,89.99,hombre,ripley,POLO (HOMBRE > 14),312010160,hombre
set enterizos  pantalón largo algodón bebé niño carters  oscuro oso polar 3 unidades tipo colección little character,carter's,105.0,moda infantil,ripley,BEBECRECE (MENOR DE 2),312050108,niño
sandalias niño colloky,colloky,118.3,calzado,ripley,ZAPATILLAS (NIÑO DE 3 A 13),321020303,niño
pantalón hombre kenneth stevens bas,kenneth stevens,59.99,hombre,ripley,PANTALÓN (HOMBRE > 14),312010154,hombre
blusa manga 34 mujer mentha y chocolate famara,mentha y chocolate,139.3,mujer,ripley,BLUSA (MUJER > 14),312020106,mujer
zapatillas   para hombre bastiann,dvx,189.0,calzado,ripley,ZAPATILLAS (HOMBRE >14),321010303,hombre
sandalias mujer schutz camel 0009u,schutz,391.92,calzado,ripley,SANDALIAS (MUJER > 14),321030115,mujer
overol bebé niño,pillin,83.4,moda infantil,ripley,BEBECRECE (MENOR DE 2),312050108,niño
set de lencería mujer shein con encaje floral 4 paquetes con bata con cinturón de satén,compra facil,102.9,mujer,ripley,ROPA INTERIOR (MUJER > 14),312020172,mujer
polera hombre reporter eydens regular fit,reporter,139.9,hombre,ripley,POLERA / SUDADERA (HOMBRE > 14),312010158,hombre
polo manga corta algodón hombre pepe jeans oliver,pepe jeans,49.99,hombre,ripley,POLO (HOMBRE > 14),312010160,hombre
body mini algodón bebé niña carters american flag manga corta,carter's,49.0,moda infantil,ripley,BEBECRECE (MENOR DE 2),312050108,niña
polo vuelos sin mangas harvest niña,harvest,20.0,moda infantil,ripley,"POLO (INCLUYE TIPO BIBIDI, TOPS, ETC.) (NIÑA DE 3 A 13)",312040142,niña
camisa manga larga hombre nautica   1bw,nautica,230.99,hombre,ripley,CAMISA (HOMBRE > 14),312010124,hombre
conjunto bebé niño colloky  pantalón tortugas,colloky,89.0,moda infantil,ripley,CONJUNTITO (MENOR DE 2),312050138,niño
billetera maui and sons  marrón,maui and sons,79.0,hombre,ripley,NO CLASIFICACIÓN,0,hombre
zapatillas puma para mujer transport   melon  07,puma,171.25,calzado,ripley,ZAPATILLAS (MUJER > 14),321030303,mujer
sandalias niña childrens club fucsia,childrens club,49.9,calzado,ripley,SANDALIAS (MUJER > 14),321030115,niña
blusa manga corta rayón mujer soda blues kailua,soda blues,99.99,mujer,ripley,BLUSA (MUJER > 14),312020106,mujer
zapatos de vestir mujer beira rio nude 43141002761952531,beira rio,104.93,calzado,ripley,ZAPATOS (MUJER > 14),321030121,mujer
pantalon drill stretch hombre yambik,pionier,189.0,hombre,ripley,PANTALÓN (HOMBRE > 14),312010154,hombre
vestido niña urpi imports rosado frozen  varita  corona,urpi imports,149.9,moda infantil,ripley,CONJUNTITO (MENOR DE 2),312050138,niña
body  cruzado manga corta  algodón pima  unisex bebe,mellow,46.9,moda infantil,ripley,BEBECRECE (MENOR DE 2),312050108,bebe
zapatilla deportiva skechers go run consistent 20,skechers,259.0,calzado,ripley,ZAPATILLAS (MUJER > 14),321030303,mujer
calzón mujer calvin klein multicolor,calvin klein,53.2,mujer,ripley,ROPA INTERIOR (MUJER > 14),312020172,mujer
ropa baño mujer index nudo textura,index,39.99,mujer,ripley,ROPA INTERIOR (MUJER > 14),312020172,mujer
polo hombre norton lollipop box khartus,norton,169.0,hombre,ripley,POLO (HOMBRE > 14),312010160,hombre
polera niño pillin  bebé,pillin,71.2,moda infantil,ripley,BEBECRECE (MENOR DE 2),312050108,niño
vestido bebé niña pillin aguamarina,pillin,87.2,moda infantil,ripley,BEBECRECE (MENOR DE 2),312050108,niña
legging larga estampada niña pillin  23,pillin,48.3,moda infantil,ripley,PANTALÓN (NIÑA DE 3 A 13),312040137,niña
casaca mujer pionier yamilet,pionier,143.99,mujer,ripley,"CASACA, CHAQUETA, GUERRERA (MUJER > 14)",312020114,mujer
blusa mujer index sin mangas pañuelo,index,79.99,mujer,ripley,BLUSA (MUJER > 14),312020106,mujer
adidas running galaxy 6  para hombre,adidas,199.9,calzado,ripley,ZAPATILLAS (HOMBRE >14),321010303,hombre
panty pillin bebé niña pack 2un,pillin,48.3,moda infantil,ripley,ROPA INTERIOR (NIÑA DE 3 A 13),312040165,niña
polo manga corta algodón hombre pepe jeans eggo,pepe jeans,59.99,hombre,ripley,POLO (HOMBRE > 14),312010160,hombre
jean algodón mom mujer exit  telerife,exit,119.4,mujer,ripley,PANTALÓN (MUJER > 14),312020137,mujer
zapatillas hombre asics running  gel dedicate,asics,359.92,calzado,ripley,ZAPATILLAS (HOMBRE >14),321010303,hombre
casaca mujer kansas  k3379a,kansas,104.99,mujer,ripley,"CASACA, CHAQUETA, GUERRERA (MUJER > 14)",312020114,mujer
short deportivo calvin klein niña,calvin klein,59.0,mujer,ripley,PANTALÓN (NIÑA DE 3 A 13),312040137,niña
jean recto hombre kansas,kansas,139.99,hombre,ripley,PANTALÓN (HOMBRE > 14),312010154,hombre
pijama short algodón mujer marquis marfil hojas,marquis,49.99,mujer,ripley,ROPA INTERIOR (MUJER > 14),312020172,mujer
camisa manga larga algodón hombre john holden,john holden,99.9,hombre,ripley,CAMISA (HOMBRE > 14),312010124,hombre
polo manga larga algodón pima unisex peyito  perú,peyito,59.9,moda infantil,ripley,POLO (HOMBRE > 14),312010160,sin genero
short algodón niña colloky  claro vuelos,colloky,35.94,moda infantil,ripley,PANTALÓN (NIÑA DE 3 A 13),312040137,niña
bata los simpsons kayser mujer,kayser,119.9,mujer,ripley,ROPA INTERIOR (MUJER > 14),312020172,mujer
billetera maui and sons  multicolor,maui and sons,79.0,hombre,ripley,NO CLASIFICACIÓN,0,hombre
edt lacoste match point hombre 50 ml,lacoste,144.5,hombre,ripley,NO CLASIFICACIÓN,0,hombre
protector cuna thadi sumaq trenzado 4 metros  algodón peruano,thadi sumaq,189.0,moda infantil,ripley,NO CLASIFICACIÓN,0,mujer
jeans suelto mujer soda blues trinity,soda blues,104.99,mujer,ripley,PANTALÓN (MUJER > 14),312020137,mujer
polera algodón hombre kayra man básico,kayra man,65.94,hombre,ripley,POLERA / SUDADERA (HOMBRE > 14),312010158,hombre
jean skinny hombre kansas,kansas,97.99,hombre,ripley,PANTALÓN (HOMBRE > 14),312010154,hombre
camisa manga corta algodón niño woallance 80   2,woallance,90.93,moda infantil,ripley,POLO (NIÑO DE 3 A 13),312030158,niño
short niño baby harvest french terry estampado,baby harvest,15.0,moda infantil,ripley,PANTALÓN (NIÑO DE 3 A 13),312030150,niño
jean wideleg mujer squeeze denim nansi,squeeze,169.99,mujer,ripley,PANTALÓN (MUJER > 14),312020137,mujer
sandalias mujer havaianas elegance,havaianas,39.9,calzado,ripley,SANDALIAS (MUJER > 14),321030115,mujer
pack calzoncillo algodón hombre calvin klein,calvin klein,79.9,hombre,ripley,ROPA INTERIOR (HOMBRE > 14),312010171,hombre
polo manga corta para hombre pierre cardin microest,pierre cardin,118.3,hombre,ripley,POLO (HOMBRE > 14),312010160,hombre
camisa manga larga algodón hombre pierre cardin pc 5912ca,pierre cardin,151.2,hombre,ripley,CAMISA (HOMBRE > 14),312010124,hombre
top sin mangas mujer liola  encaje,liola,151.92,mujer,ripley,ROPA INTERIOR (MUJER > 14),312020172,mujer
pack 2 sostén mujer jacinta fernandez  tops,jacinta fernandez,129.9,mujer,ripley,ROPA INTERIOR (MUJER > 14),312020172,mujer
visera todo gorros peru running amarilla,todo gorros peru,28.9,mujer,ripley,ROPA DEPORTIVA (MUJER > 14),312020168,mujer
zapatillas mujer marquis mayra,marquis,90.0,calzado,ripley,ZAPATILLAS (MUJER > 14),321030303,mujer
polera manga larga hombre volcom  chillout pullover,volcom,189.99,hombre,ripley,POLERA / SUDADERA (HOMBRE > 14),312010158,hombre
polo manga corta algodón hombre woallance clasico,woallance,49.9,hombre,ripley,POLO (HOMBRE > 14),312010160,hombre
falda mujer marquis fa set b,marquis,111.99,mujer,ripley,VESTIDO PARA OCASIONES ESPECIALES (MUJER > 14),312020165,mujer
casaca hombre dockers  packable jacket,dockers,227.4,hombre,ripley,"CASACA, CHAQUETA, GUERRERA (HOMBRE > 14)",312010132,hombre
zapatillas hombre caterpillar urbanas  hex,caterpillar,289.9,calzado,ripley,ZAPATILLAS (HOMBRE >14),321010303,hombre
pack trusas niña handcraft multicolor turning red,handcraft,98.9,moda infantil,ripley,ROPA INTERIOR (NIÑA DE 3 A 13),312040165,niña
palmers pack 3 sosten algodón,palmers,79.9,mujer,ripley,ROPA INTERIOR (MUJER > 14),312020172,mujer
jean skinny hombre parada  ruiz,parada 111,169.99,hombre,ripley,PANTALÓN (HOMBRE > 14),312010154,hombre
jardinera next para niña,next,104.99,moda infantil,ripley,CONJUNTITO (MENOR DE 2),312050138,niña
gorro maui and sons   hombre,maui and sons,79.9,hombre,ripley,ROPA DEPORTIVA (HOMBRE > 14),312010167,hombre
polo manga corta hombre pepe jeans craigton,pepe jeans,47.99,hombre,ripley,POLO (HOMBRE > 14),312010160,hombre
casaca algodón mujer esprit oliva 033cc1g303 quilted,esprit,140.0,mujer,ripley,"CASACA, CHAQUETA, GUERRERA (MUJER > 14)",312020114,mujer
pijama pantalón mujer marquis felpa,marquis,59.99,mujer,ripley,ROPA INTERIOR (MUJER > 14),312020172,mujer
faja mujer lancaster  plctsmmd1blan polo tiras control,lancaster,30.0,mujer,ripley,ROPA INTERIOR (MUJER > 14),312020172,mujer
casaca hombre dockers café padded jacket,dockers,209.4,hombre,ripley,"CASACA, CHAQUETA, GUERRERA (HOMBRE > 14)",312010132,hombre
gorro algodón new era  the league collection magic,new era,129.95,hombre,ripley,ROPA DEPORTIVA (HOMBRE > 14),312010167,hombre
zapatillas hombre new balance urbanas  ct500cg,new balance,499.9,calzado,ripley,ZAPATILLAS (HOMBRE >14),321010303,hombre
jean largo slim hombre kansas,kansas,99.99,hombre,ripley,PANTALÓN (HOMBRE > 14),312010154,hombre
short hombre everlast  swing 20,everlast,99.9,hombre,ripley,PANTALÓN CORTO (HOMBRE > 14),312010153,hombre
