Item,Marca,Precio,Categoria,Web,class_inei,codigo,genero
skinny adriana marca,sassari,95.0,moda mujer,falabella,PANTALÓN (MUJER > 14),312020137,mujer
zapatillas football   hombre,new athletic,197.7,zapatos,falabella,ZAPATILLAS (HOMBRE >14),321010303,hombre
zapatilla hex mujer,cat,299.9,zapatillas urbanas mujer,falabella,ZAPATILLAS (MUJER > 14),321030303,mujer
luces roller celebration,bibi,229.9,zapatos niño,falabella,NO CLASIFICACIÓN,0,niño
tshirt jersey mujer rholling squeeze,gzuck,69.0,moda mujer,falabella,"POLO (INCLUYE TIPO BIBIDI, TOPS, ETC.) (MUJER > 14)",312020142,mujer
zapatillas urbanas hombre speciali terrace,umbro,113.94,zapatos,falabella,ZAPATILLAS (HOMBRE >14),321010303,hombre
botas mujer clásicas taco 5 gamuza 2035l 60,generico,119.0,botas de mujer,falabella,BOTAS (MUJER > 14),321030106,mujer
jean saragoza  mujer,exit,99.5,moda mujer,falabella,PANTALÓN (MUJER > 14),312020137,mujer
polo full print manga corta hombre,redwood,21.9,moda hombre,falabella,POLO (HOMBRE > 14),312010160,hombre
sandalia casual para mujer,sthef,29.0,sandalias mujeres,falabella,SANDALIAS (MUJER > 14),321030115,mujer
zuecos off court clog blackblack unisex,crocs,259.0,zapatos,falabella,ZAPATOS (HOMBRE >14),321010121,sin genero
jeans algodón mujer kayra,kayra poblet,159.9,moda mujer,falabella,PANTALÓN (MUJER > 14),312020137,mujer
vestido mujer,mango,249.9,moda mujer,falabella,VESTIDO PARA OCASIONES ESPECIALES (MUJER > 14),312020165,mujer
zapato mocasin plataforma mujer vicky cuero cobre,corelli,169.99,mocasines,falabella,ZAPATOS (MUJER > 14),321030121,mujer
vestido de niña rosado en la tematica my little pony con perlas,generico,230.0,ropa de niñas,falabella,NO CLASIFICACIÓN,0,niña
chompa tejida face,now,159.9,moda mujer,falabella,CHOMPA / SUÉTER (MUJER > 14),312020117,mujer
zapatilla x ray square  50 multicolor para hombre,puma,269.0,zapatos,falabella,ZAPATILLAS (HOMBRE >14),321010303,hombre
jean wide niña,redwood,39.9,ropa de niñas,falabella,PANTALÓN (NIÑA DE 3 A 13),312040137,niña
sandalias leadcat 20 elevate  02 purpura para mujer,puma,95.0,sandalias mujeres,falabella,SANDALIAS (MUJER > 14),321030115,mujer
balerinas mujer misshus abril arena,generico,35.0,sandalias mujeres,falabella,ZAPATOS (MUJER > 14),321030121,mujer
zapatos de vestir mujer nude,marglo shoes,143.92,zapatos casuales mujer,falabella,ZAPATOS (MUJER > 14),321030121,mujer
polo faja alta compresión cintura flacidez ginecomastia y abdomen,generico,67.0,ropa interior y pijamas,falabella,ROPA INTERIOR (MUJER > 14),312020172,mujer
pantalones largos de primavera y otoño para hombres,blwoens,149.0,moda hombre,falabella,PANTALÓN (HOMBRE > 14),312010154,hombre
panty algodón bebé niña gruesa invierno   lila,little chicks,39.0,ropa de niñas,falabella,NO CLASIFICACIÓN,0,niña
botines  t,sthef,79.0,botines mujer,falabella,BOTAS (MUJER > 14),321030106,mujer
conjunto para bebé barquito,generico,55.0,ropa de bebe niño,falabella,CONJUNTITO (MENOR DE 2),312050138,bebe
jogger minions franela niños,generico,34.9,ropa de niñas,falabella,NO CLASIFICACIÓN,0,niño
zapatillas urbanas niña,ortopasso,77.94,zapatos niña,falabella,ZAPATILLAS (NIÑA DE 3 A 13),321040303,niña
lenceria 4pz portaligas de encaje camila  de alcoba,generico,240.0,calzones,falabella,ROPA INTERIOR (MUJER > 14),312020172,mujer
bucket hat baby shark 52cm gorro para niños de 2 a 5 años,kast pe,55.0,ropa de bebe niño,falabella,NO CLASIFICACIÓN,0,niño
zapatilla unisex niño tensaur run 30 j,adidas,191.0,zapatos niña,falabella,ZAPATILLAS (NIÑO DE 3 A 13),321020303,niño
vestido angora con foil para niña kidsmashmelo,kids mashmelo,79.0,ropa de niñas,falabella,NO CLASIFICACIÓN,0,niña
zapatillas urbanas mujer,kolosh,113.94,zapatillas urbanas mujer,falabella,ZAPATILLAS (MUJER > 14),321030303,mujer
zapatillas urbanas niño,molekinho,97.93,zapatos niño,falabella,ZAPATILLAS (NIÑO DE 3 A 13),321020303,niño
polo hombre  estampado,yansus,35.9,moda hombre,falabella,POLO (HOMBRE > 14),312010160,hombre
polo niña manga corta algodón,eleven,39.9,ropa de niños,falabella,"POLO (INCLUYE TIPO BIBIDI, TOPS, ETC.) (NIÑA DE 3 A 13)",312040142,niña
zapatillas urbanas mujer clubhouse,aldo,229.9,zapatillas urbanas mujer,falabella,ZAPATILLAS (MUJER > 14),321030303,mujer
top sm tejido,naf naf,129.9,moda mujer,falabella,"POLO (INCLUYE TIPO BIBIDI, TOPS, ETC.) (MUJER > 14)",312020142,mujer
sandalias crocband flip quartz unisex,crocs,169.0,sandalias mujeres,falabella,SANDALIAS (MUJER > 14),321030115,sin genero
zapatilla casual teri  avenhues cuero,viale,219.9,zapatillas urbanas mujer,falabella,NO CLASIFICACIÓN,0,mujer
vestido para cumpleaños y promocion para niñas nude  con cola,generico,350.0,ropa de niñas,falabella,NO CLASIFICACIÓN,0,niña
corrector de postura body help,generico,49.0,calzones,falabella,NO CLASIFICACIÓN,0,mujer
polera hombre genez,tapout,119.9,moda hombre,falabella,POLERA / SUDADERA (HOMBRE > 14),312010158,hombre
denim midi california skirt,vera donna,188.1,moda mujer,falabella,NO CLASIFICACIÓN,0,mujer
top mercy     colección de verano   varios colores,marwal,89.0,moda mujer,falabella,"POLO (INCLUYE TIPO BIBIDI, TOPS, ETC.) (MUJER > 14)",312020142,mujer
pantalones para toda ocasión,generico,38.9,moda mujer,falabella,PANTALÓN (MUJER > 14),312020137,mujer
zapatilla advantage  para mujer,adidas,294.7,zapatillas urbanas mujer,falabella,ZAPATILLAS (MUJER > 14),321030303,mujer
vestido corto algodón mujer,mango,289.9,moda mujer,falabella,VESTIDO PARA OCASIONES ESPECIALES (MUJER > 14),312020165,mujer
body niña algodón manga corta,kids mashmelo,45.0,ropa de niñas,falabella,NO CLASIFICACIÓN,0,niña
botas mujer clásicas taco 5 2035l 60,generico,119.0,botas de mujer,falabella,BOTAS (MUJER > 14),321030106,mujer
zapatillas skye wedge  01,puma,299.9,zapatillas urbanas mujer,falabella,ZAPATILLAS (MUJER > 14),321030303,mujer
sombrero gorro alta proteccion cubre nuca transpirable   khaki oscuro,kast pe,45.9,gorros y sombreros,falabella,NO CLASIFICACIÓN,0,mujer
zapatillas outdoor montfor47  hombre,new athletic,160.3,zapatos,falabella,ZAPATILLAS (HOMBRE >14),321010303,hombre
zapatillas puro cuero,maribu,199.0,zapatos casuales mujer,falabella,ZAPATILLAS (MUJER > 14),321030303,mujer
polo mujer ari llama,hangertips,69.0,moda mujer,falabella,"POLO (INCLUYE TIPO BIBIDI, TOPS, ETC.) (MUJER > 14)",312020142,mujer
botín casual  mujer,generico,139.9,botines mujer,falabella,BOTAS (MUJER > 14),321030106,mujer
polera de algodón para hombre bvsic,fleiri and manner,119.9,moda hombre,falabella,POLERA / SUDADERA (HOMBRE > 14),312010158,hombre
polera casual mujer,vero moda,69.93,moda mujer,falabella,NO CLASIFICACIÓN,0,mujer
zapatilla mujer zara,aranni,169.0,zapatillas urbanas mujer,falabella,ZAPATILLAS (MUJER > 14),321030303,mujer
pantalon skinny jean strech,generico,79.9,moda mujer,falabella,PANTALÓN (MUJER > 14),312020137,mujer
sandalias mujer plataforma kim,lb libby calzados y accesorios,99.0,sandalias mujeres,falabella,SANDALIAS (MUJER > 14),321030115,mujer
pantalón bebé niño algodón,mango kids,41.94,ropa de bebe niño,falabella,PANTALÓN (MENOR DE 2),312050152,niño
conjunto de niño modelo osito    set de 3 piezas,generico,165.9,ropa de bebe niño,falabella,CONJUNTITO (MENOR DE 2),312050138,niño
sandalia plataforma negra mujer,gotta,199.0,botas de mujer,falabella,SANDALIAS (MUJER > 14),321030115,mujer
botines niñas b,moletic,119.0,zapatos niña,falabella,ZAPATOS (NIÑA DE 3 A 13),321040118,niña
polo manga corta hombre soulsey,riff&raff,35.94,moda hombre,falabella,POLO (HOMBRE > 14),312010160,hombre
polo hombre tricolor    militar,yansus,34.9,moda hombre,falabella,POLO (HOMBRE > 14),312010160,hombre
short casual mujer,university club,79.9,moda mujer,falabella,PANTALÓN CORTO (MUJER > 14),312020136,mujer
zapatillas champion hombre ot alter,asia import,289.0,zapatos,falabella,ZAPATILLAS (HOMBRE >14),321010303,hombre
vestido de verano zahira    talla,kast pe,120.0,moda mujer,falabella,NO CLASIFICACIÓN,0,mujer
chompa ravenclaw harry potter   tallas 16 hasta,generico,82.9,moda hombre,falabella,CHOMPA / SUÉTER (HOMBRE > 14),312010138,hombre
enterizo fit niña  lila gl 28,generico,49.99,moda mujer,falabella,NO CLASIFICACIÓN,0,niña
polera con capucha para mujer,generico,99.0,moda mujer,falabella,NO CLASIFICACIÓN,0,mujer
botines taco 2  crema,chabely,309.0,botines mujer,falabella,BOTAS (MUJER > 14),321030106,mujer
medias pack x3 hombre,jockey,65.0,ropa interior y pijamas,falabella,CALCETINES (HOMBRE > 14),312010119,hombre
conjunto bebé niña niño algodón pima orgánico doggie,incahugs,85.0,ropa de bebe niño,falabella,CONJUNTITO (MENOR DE 2),312050138,niño
polo manga corta d nuñez   beakhyun unisex,generico,34.9,moda hombre,falabella,POLO (HOMBRE > 14),312010160,sin genero
faja moldeaora reductora body encaje,confort,79.9,moda mujer,falabella,ROPA INTERIOR (MUJER > 14),312020172,mujer
gorra chicago  sox mlb 9fifty,new era,149.9,gorros y sombreros,falabella,NO CLASIFICACIÓN,0,mujer
polo manga corta hombre malbe,tapout,49.9,moda hombre,falabella,POLO (HOMBRE > 14),312010160,hombre
zapatillas de fútbol hombre  league pasto sintético,adidas,359.0,zapatos,falabella,ZAPATILLAS (HOMBRE >14),321010303,hombre
gorra de cleveland cavaliers 59fifty dark red,new era,159.9,gorros y sombreros,falabella,NO CLASIFICACIÓN,0,mujer
botas de lluvia laura  con taco,generico,129.0,botas de mujer,falabella,BOTAS (MUJER > 14),321030106,mujer
medias invisible mujer pack 3,rybiu import,22.9,medias,falabella,MEDIAS (MUJER > 14),312020131,mujer
short ultimate solid straight fit porcelain khaki,dockers,107.0,moda hombre,falabella,PANTALÓN CORTO (HOMBRE > 14),312010153,hombre
polera dexmen cierre,dm dexmen,69.0,moda hombre,falabella,POLERA / SUDADERA (HOMBRE > 14),312010158,hombre
blusa  lino mujer,mango,179.9,moda mujer,falabella,BLUSA (MUJER > 14),312020106,mujer
sandalia mickey para niños en,generico,39.9,zapatos niño,falabella,NO CLASIFICACIÓN,0,niño
polo manga corta   d nuñez   llama peru,generico,34.9,moda hombre,falabella,POLO (HOMBRE > 14),312010160,hombre
polo mujer manga corta mafalda   nathalie love it   rosado,generico,39.99,moda mujer,falabella,"POLO (INCLUYE TIPO BIBIDI, TOPS, ETC.) (MUJER > 14)",312020142,mujer
correa suleneg,tabu,29.9,correas,falabella,NO CLASIFICACIÓN,0,mujer
polo semiboxy coastal shadow,generico,69.0,moda hombre,falabella,POLO (HOMBRE > 14),312010160,hombre
zapatillas urbanas mujer andree,aldo,349.9,zapatillas urbanas mujer,falabella,ZAPATILLAS (MUJER > 14),321030303,mujer
camisa moda slim fit manga larga hombre,isague,60.0,moda hombre,falabella,CAMISA (HOMBRE > 14),312010124,hombre
polo clasico grupo musical public enemy 01,generico,64.9,moda hombre,falabella,POLO (HOMBRE > 14),312010160,hombre
sandalia kb 53530265s25,colloky,169.0,zapatos niño,falabella,NO CLASIFICACIÓN,0,niño
zapatillas deportivas outdoor mujer crosslander 3 mid wp  marrón,merrell,449.9,zapatillas deportivas mujer,falabella,ZAPATILLAS (MUJER > 14),321030303,mujer
casaca casual  algodón mujer,fordan jeans,110.4,moda mujer,falabella,"CASACA, CHAQUETA, GUERRERA (MUJER > 14)",312020114,mujer
pack 3 medias flexibles niño rybiu,rybiu import,33.9,ropa de niños,falabella,NO CLASIFICACIÓN,0,niño
polo básico  algodón  ivory niña bordado,le petit company,49.0,ropa de niños,falabella,"POLO (INCLUYE TIPO BIBIDI, TOPS, ETC.) (NIÑA DE 3 A 13)",312040142,niña
zapatillas   sneaker 31,estodas,279.0,zapatillas urbanas mujer,falabella,ZAPATILLAS (MUJER > 14),321030303,mujer
chompa bebé hilo   corazones   salmon,generico,55.0,ropa de bebe niño,falabella,NO CLASIFICACIÓN,0,bebe
polo luminoso anime manga kimetsu no yaiba   tokito,nacional,61.0,moda mujer,falabella,"POLO (INCLUYE TIPO BIBIDI, TOPS, ETC.) (MUJER > 14)",312020142,mujer
botín casual para mujer,nonos,155.9,botas de mujer,falabella,BOTAS (MUJER > 14),321030106,mujer
polo manga corta   d nuñez   chucky unisex,generico,39.9,ropa de niños,falabella,POLO (NIÑO DE 3 A 13),312030158,sin genero
pack 3 bivirí slim fit hombre,rybiu import,46.9,moda hombre,falabella,ROPA INTERIOR (HOMBRE > 14),312010171,hombre
medias mujer calan,aldo,49.9,medias,falabella,MEDIAS (MUJER > 14),312020131,mujer
sandalia para dama gma,g'mapiel,229.0,sandalias mujeres,falabella,SANDALIAS (MUJER > 14),321030115,mujer
zapatilla hombre air zoom gt cut,nike,442.0,zapatos,falabella,ZAPATILLAS (HOMBRE >14),321010303,hombre
zapatilla mujer,actvitta,68.94,zapatillas deportivas mujer,falabella,ZAPATILLAS (MUJER > 14),321030303,mujer
faja post operatoria de algodón unisex talla,leemark,51.0,fajas y modeladores,falabella,ROPA INTERIOR (MUJER > 14),312020172,sin genero
zapatillas urbanas niños   35 39,r18,159.0,zapatos niño,falabella,ZAPATILLAS (NIÑO DE 3 A 13),321020303,niño
top algodón mujer,denimlab,44.95,moda mujer,falabella,"POLO (INCLUYE TIPO BIBIDI, TOPS, ETC.) (MUJER > 14)",312020142,mujer
faja control abdomen,leonisa,189.9,fajas y modeladores,falabella,ROPA INTERIOR (MUJER > 14),312020172,mujer
calza niña x2 algodón,barbie,39.9,ropa de niñas,falabella,PANTALÓN (NIÑA DE 3 A 13),312040137,niña
zapatilla reflect lite trail  06  para hombre,puma,239.0,zapatos,falabella,ZAPATILLAS (HOMBRE >14),321010303,hombre
enterizo mujer,mango,389.9,moda mujer,falabella,NO CLASIFICACIÓN,0,mujer
mocasines casuales comfit paulina camel mujer,bata,125.91,mocasines,falabella,ZAPATOS (MUJER > 14),321030121,mujer
camisa de mezclilla casual mujer,tiozoney,239.0,moda mujer,falabella,BLUSA (MUJER > 14),312020106,mujer
zapatillas ivanna,generico,99.0,zapatillas urbanas mujer,falabella,ZAPATILLAS (MUJER > 14),321030303,mujer
botines mujeres fch  35 40 barri,footloose,114.0,botas de mujer,falabella,BOTAS (MUJER > 14),321030106,mujer
stilettos eleanor para dama   fucsia,generico,159.0,zapatos casuales mujer,falabella,ZAPATOS (MUJER > 14),321030121,mujer
polo casual hombre,cortefiel,159.9,moda hombre,falabella,POLO (HOMBRE > 14),312010160,hombre
vestido corto shein bae,generico,129.99,moda mujer,falabella,VESTIDO PARA OCASIONES ESPECIALES (MUJER > 14),312020165,mujer
polo básico  algodón  niño niña con bolsillo,le petit company,49.0,ropa de niñas,falabella,PANTALÓN (NIÑA DE 3 A 13),312040137,niño
vestido sexy largo   para fiesta,generico,199.0,moda mujer,falabella,VESTIDO PARA OCASIONES ESPECIALES (MUJER > 14),312020165,mujer
sandalias mujer,vizzano,89.94,sandalias mujeres,falabella,SANDALIAS (MUJER > 14),321030115,mujer
bata polar casablanca home,generico,169.0,batas,falabella,NO CLASIFICACIÓN,0,mujer
zapatillas running hombre response,adidas,207.2,zapatos,falabella,ZAPATILLAS (HOMBRE >14),321010303,hombre
zapatillas grand court 20 hombre,adidas,238.0,zapatos,falabella,ZAPATILLAS (HOMBRE >14),321010303,hombre
jumper  niña   jumper emilia,valu moda infantil,125.0,ropa de niñas,falabella,NO CLASIFICACIÓN,0,niña
sandalias de playa annie  bubblegummers niño,bubble gummers,59.9,zapatos niño,falabella,NO CLASIFICACIÓN,0,niño
sandalia casual mujer,vizzano,129.9,sandalias mujeres,falabella,SANDALIAS (MUJER > 14),321030115,mujer
zapatillas  mujer,gotta,129.0,zapatillas urbanas mujer,falabella,ZAPATILLAS (MUJER > 14),321030303,mujer
botas de cuero niña,calzados alito,169.0,zapatos niña,falabella,ZAPATOS (NIÑA DE 3 A 13),321040118,niña
camisa manga larga piero biani hombre,generico,55.0,moda hombre,falabella,CAMISA (HOMBRE > 14),312010124,hombre
sandalias niña  jean  textil,impuls,49.9,zapatos niña,falabella,NO CLASIFICACIÓN,0,niña
zapatillas urbanas mujer court advance,reebok,189.0,zapatos niña,falabella,ZAPATILLAS (MUJER > 14),321030303,mujer
polo de niña marca americana,generico,39.0,ropa de niñas,falabella,"POLO (INCLUYE TIPO BIBIDI, TOPS, ETC.) (NIÑA DE 3 A 13)",312040142,niña
ballerinas mujer leonor,flabelus,499.0,zapatos casuales mujer,falabella,ZAPATOS (MUJER > 14),321030121,mujer
pantalon jean strech,generico,84.9,moda mujer,falabella,PANTALÓN (MUJER > 14),312020137,mujer
sandalia strap casual linda  pelehueso cuero,viale,229.9,sandalias mujeres,falabella,SANDALIAS (MUJER > 14),321030115,mujer
zapatilla running mujer,kaida,109.9,zapatillas deportivas mujer,falabella,ZAPATILLAS (MUJER > 14),321030303,mujer
sandalias mujer crema,modare,89.94,sandalias mujeres,falabella,SANDALIAS (MUJER > 14),321030115,mujer
sandalias deirbhile para dama   plateado,generico,149.0,sandalias mujeres,falabella,SANDALIAS (MUJER > 14),321030115,mujer
polo algodón hombre,newport,39.9,moda hombre,falabella,POLO (HOMBRE > 14),312010160,hombre
botines dr martens   smooth unisex,dr martens,849.0,botines mujer,falabella,ZAPATOS (HOMBRE >14),321010121,sin genero
medias algodón diseño multicolor hombre,lancaster,10.0,ropa interior y pijamas,falabella,CALCETINES (HOMBRE > 14),312010119,hombre
escolar niño pei uou selene coffie,pei unique outfit,118.0,zapatos niña,falabella,NO CLASIFICACIÓN,0,niño
casaca básica unisex,peace and love,109.0,moda mujer,falabella,"CASACA, CHAQUETA, GUERRERA (MUJER > 14)",312020114,sin genero
polo clasico mtv 03,generico,64.9,zapatos,falabella,NO CLASIFICACIÓN,0,mujer
zapatos mocasines mujer luanna02 café claro cuero natural,ecco,259.9,mocasines,falabella,ZAPATOS (HOMBRE >14),321010121,mujer
blusa niña en denim,illika,89.0,ropa de niñas,falabella,NO CLASIFICACIÓN,0,niña
conjunto franela reactiva   2 piezas   dino   plomo,generico,59.0,ropa de niños,falabella,NO CLASIFICACIÓN,0,niño
sandalias para g2footloose fnp  35 39 margueri nude,footloose,149.9,sandalias mujeres,falabella,SANDALIAS (MUJER > 14),321030115,mujer
zapatillas urbanas unisex palermo lth ac inf,puma,199.0,zapatos niño,falabella,ZAPATILLAS (HOMBRE >14),321010303,sin genero
camison maternal victoria manga cero algodón bcxy lenceria maternal,generico,123.0,moda mujer,falabella,NO CLASIFICACIÓN,0,mujer
medias unisex deportivas,puma,39.9,medias,falabella,CALCETINES (HOMBRE > 14),312010119,sin genero
boxer pack  x3 hombre,wessel,89.99,ropa interior y pijamas,falabella,ROPA INTERIOR (HOMBRE > 14),312010171,hombre
botin cdk,calimod femme,399.9,botines mujer,falabella,BOTAS (MUJER > 14),321030106,mujer
zapatos formales hombre,carusso,191.2,zapatos,falabella,ZAPATOS (HOMBRE >14),321010121,hombre
bermuda franela bebé niño  23,pillin,35.0,ropa de bebe niño,falabella,NO CLASIFICACIÓN,0,niño
gorro boston red sox mlb 59fifthy,new era,199.9,gorros y sombreros,falabella,NO CLASIFICACIÓN,0,mujer
chest binder faja de pecho compresion de pecho ftm tomboy,generico,67.0,calzones,falabella,ROPA INTERIOR (MUJER > 14),312020172,mujer
polo para ñiño figura animada,generico,29.0,ropa de niños,falabella,POLO (NIÑO DE 3 A 13),312030158,niño
11575c 45 zapatilla mujer polar baja,generico,89.0,zapatillas urbanas mujer,falabella,ZAPATILLAS (MUJER > 14),321030303,mujer
vestido corto algodón mujer,mango,389.9,moda mujer,falabella,VESTIDO PARA OCASIONES ESPECIALES (MUJER > 14),312020165,mujer
botín  mujer,gotta,109.0,zapatos casuales mujer,falabella,ZAPATOS (MUJER > 14),321030121,mujer
media felpa clásica unisex para adulto   algodón   pack x3,sydney,69.0,medias,falabella,CALCETINES (HOMBRE > 14),312010119,sin genero
faja de pecho compresor de pecho chest binder trans tomboy,generico,67.0,calzones,falabella,ROPA INTERIOR (MUJER > 14),312020172,mujer
gorro hombre,doo australia,19.95,gorros y sombreros,falabella,NO CLASIFICACIÓN,0,hombre
polo hombre manga corta diseño grinch,generico,49.99,moda hombre,falabella,POLO (HOMBRE > 14),312010160,hombre
blazer  algodón mujer,denimlab,99.95,moda mujer,falabella,NO CLASIFICACIÓN,0,mujer
vestido arabesque,top danza,76.0,ropa de niñas,falabella,NO CLASIFICACIÓN,0,niña
faja cinturilla reductora unisex hot belt power shaper,oem,14.9,fajas y modeladores,falabella,ROPA INTERIOR (MUJER > 14),312020172,sin genero
panty para niñas delgada de nylon   fucsia,little chicks,24.0,ropa de niñas,falabella,ROPA INTERIOR (NIÑA DE 3 A 13),312040165,niña
sandalia mujer bohemia plataforma  5c 55 taco 7 cuña,generico,109.0,sandalias mujeres,falabella,SANDALIAS (MUJER > 14),321030115,mujer
casaca denim hombre izack,norton,289.0,moda hombre,falabella,"CASACA, CHAQUETA, GUERRERA (HOMBRE > 14)",312010132,hombre
sandalias para fiesta mujer  lila,impuls,84.9,sandalias mujeres,falabella,SANDALIAS (MUJER > 14),321030115,mujer
gorra hombre,new era,149.9,gorros y sombreros,falabella,NO CLASIFICACIÓN,0,hombre
hipster invisible de buen cubrimiento,leonisa,44.9,calzones,falabella,NO CLASIFICACIÓN,0,mujer
polo hombre ss relaxed fit tee,levis,64.0,moda hombre,falabella,POLO (HOMBRE > 14),312010160,hombre
polo de algodón pima  agua rayado,red carrot,20.0,moda hombre,falabella,POLO (HOMBRE > 14),312010160,hombre
vestido niña floreado mariposas bicicleta manga corta yooki kids,generico,72.0,ropa de niñas,falabella,NO CLASIFICACIÓN,0,niña
polo clasico banda de rock motorhead 02,generico,64.9,moda hombre,falabella,POLO (HOMBRE > 14),312010160,hombre
mocasin ferrara   palo,nebula,101.94,mocasines,falabella,ZAPATOS (MUJER > 14),321030121,mujer
bood tape cinta levanta busto senos parche de busto senos cubre pezón,generico,19.9,sostenes,falabella,NO CLASIFICACIÓN,0,mujer
zapatilla casual jan  grisacer,adv,139.9,zapatillas urbanas mujer,falabella,NO CLASIFICACIÓN,0,mujer
polo manga corta d nuñez   capibara b unisex  g abrazo,generico,39.9,moda hombre,falabella,POLO (HOMBRE > 14),312010160,sin genero
denim wide leg clásico liso,generico,99.9,moda mujer,falabella,PANTALÓN (MUJER > 14),312020137,mujer
polo hombre  estampado gato,yansus,35.9,moda hombre,falabella,POLO (HOMBRE > 14),312010160,hombre
zapatillas urbanas niña,colloky,111.2,zapatos niña,falabella,ZAPATILLAS (NIÑA DE 3 A 13),321040303,niña
top para niña en rib sin estampado,kids mashmelo,25.0,ropa de niñas,falabella,"POLO (INCLUYE TIPO BIBIDI, TOPS, ETC.) (NIÑA DE 3 A 13)",312040142,niña
botas otsu   nébula   camel,nebula,125.94,botas de mujer,falabella,BOTAS (MUJER > 14),321030106,mujer
polo niña kuromi  manga corta,generico,49.9,ropa de niñas,falabella,"POLO (INCLUYE TIPO BIBIDI, TOPS, ETC.) (NIÑA DE 3 A 13)",312040142,niña
zapatillas para mujeres   35 40,r18,140.0,zapatillas urbanas mujer,falabella,ZAPATILLAS (MUJER > 14),321030303,mujer
botines wavre,nebula,131.94,botas de mujer,falabella,BOTAS (MUJER > 14),321030106,mujer
jean recto algodón mujer,doo australia,89.9,moda mujer,falabella,PANTALÓN (MUJER > 14),312020137,mujer
correa hombre,billabong,34.5,correas,falabella,CORREA (HOMBRE >14),313010115,hombre
botas mujer,modare,229.9,botas de mujer,falabella,BOTAS (MUJER > 14),321030106,mujer
botas de lluvia modelo children  tallas 21 a 33,generico,49.0,zapatos niña,falabella,BOTAS (MUJER > 14),321030106,niña
pantufla vaquita kawaii unisex talla 36 37,generico,99.99,zapatos,falabella,NO CLASIFICACIÓN,0,sin genero
polo x minecraft aop crew neck hombre talla sm,puma,129.0,moda hombre,falabella,POLO (HOMBRE > 14),312010160,hombre
top peplum griselda,miss lady,99.0,moda mujer,falabella,"POLO (INCLUYE TIPO BIBIDI, TOPS, ETC.) (MUJER > 14)",312020142,mujer
jean algodón hombre,mossimo,83.94,moda hombre,falabella,PANTALÓN (HOMBRE > 14),312010154,hombre
mocasin vratsa      charol,nebula,101.94,mocasines,falabella,ZAPATOS (MUJER > 14),321030121,mujer
gorra superman  yth,new era,89.9,ropa de niños,falabella,NO CLASIFICACIÓN,0,niño
camisa hombre classic,levis,179.0,moda hombre,falabella,CAMISA (HOMBRE > 14),312010124,hombre
zapatos de vestir niñas,lucky bear,129.0,zapatos niña,falabella,ZAPATOS (NIÑA DE 3 A 13),321040118,niña
zapatillas training mujer rapidmove trainer,adidas,287.2,zapatillas deportivas mujer,falabella,ZAPATILLAS (MUJER > 14),321030303,mujer
botas bado   nébula    cuero,nebula,125.94,botas de mujer,falabella,BOTAS (MUJER > 14),321030106,mujer
balerinas renascence,bibi,107.9,zapatos niña,falabella,ZAPATOS (NIÑA DE 3 A 13),321040118,niña
medias deportivas algodón afelpadas ventilación infantil,lancaster,7.5,ropa de niños,falabella,NO CLASIFICACIÓN,0,niño
polo manga corta algodón hombre,american eagle,79.9,moda hombre,falabella,POLO (HOMBRE > 14),312010160,hombre
polo casual mujer,stefano cocci,53.94,moda mujer,falabella,"POLO (INCLUYE TIPO BIBIDI, TOPS, ETC.) (MUJER > 14)",312020142,mujer
falda short  algodón mujer,kansas,109.9,moda mujer,falabella,PANTALÓN CORTO (MUJER > 14),312020136,mujer
pack 2 polo cafarena bebé   algodón pimatalla 1,generico,50.0,ropa de bebe niño,falabella,NO CLASIFICACIÓN,0,bebe
jogger franela niños,generico,39.9,ropa de niñas,falabella,NO CLASIFICACIÓN,0,niño
short dexmen cargo drill,dm dexmen,65.0,moda hombre,falabella,PANTALÓN CORTO (HOMBRE > 14),312010153,hombre
zapatillas urbanas team  mujer,north star,111.93,zapatillas urbanas mujer,falabella,ZAPATILLAS (MUJER > 14),321030303,mujer
casaca modelo americana,new york stars,74.9,moda mujer,falabella,"CASACA, CHAQUETA, GUERRERA (MUJER > 14)",312020114,mujer
zapatos de vestir mujer  court ne,clarks,319.92,zapatos formales mujer,falabella,ZAPATOS (MUJER > 14),321030121,mujer
balerina para mujer salma,irisaba,89.0,sandalias mujeres,falabella,ZAPATOS (MUJER > 14),321030121,mujer
gorro 59fifty mlb oakland athletics mlb acperf dark,new era,159.9,gorros y sombreros,falabella,NO CLASIFICACIÓN,0,mujer
sandalia mujer cuña 12 plataforma 7 2086l 55,generico,99.0,sandalias mujeres,falabella,SANDALIAS (MUJER > 14),321030115,mujer
dnuñez polera con capucha bolsillos canguro   gretel abrazo,generico,99.9,moda hombre,falabella,POLERA / SUDADERA (HOMBRE > 14),312010158,hombre
pantufla bulldog toffee fancy,generico,90.0,zapatos,falabella,NO CLASIFICACIÓN,0,mujer
jean algodón mujer,american abbey,89.9,moda mujer,falabella,PANTALÓN (MUJER > 14),312020137,mujer
botas úrsula gamuza,generico,229.0,botas de mujer,falabella,BOTAS (MUJER > 14),321030106,mujer
zapatillas urbanas niño sp lowout5pe,yamp,69.93,zapatos niño,falabella,ZAPATILLAS (NIÑO DE 3 A 13),321020303,niño
casaca de peluche unisex para niño o niña lacre,tifanti,99.0,ropa de niños,falabella,NO CLASIFICACIÓN,0,niño
